URL,Informative_Text,Texts
http://www.muuduufurniture.com/products/frame-material/wood/,"3Pcs Dark Chocolate and Cream Faux Leather Sofa Set, 3Pcs Purple Fabric Sofa Set, Amaris Dark Brown Loveseat, Abrianna Gray Love Seat, Amaris Dark Brown Recliner,  3Pcs Cream Faux Leather Sofa Set, Augustina Light Brown Sofa, Azis Gray Fabric Love Seat, Augustina Light Brown Love Seat, Augustina Light Brown Chair, Augustina Light Brown Sofa Set, 2Pcs Mid-Century Dining Chair, 3Pcs Dark Brown Faux Leather Sofa Set, Anita Espresso Power Love Seat, 3Pcs Rose Gold Faux Leather Sofa Set, 3Pcs White Microfiber Leather Sofa Set, Amaris Dark Brown Sofa Set, Ash Sofa Set, Atlantic Loveseat, 3Pcs Taupe Microfiber Leather Sofa Set, Aislin Espresso Ottoman, Abrianna Brown Sofa, Asma Beige Sofa Set, Badalona I Grey Love Seat, Abrianna Brown Sofa Set, Aislin Espresso Chair, Alicia Light Brown Love Seat, Amaris Dark Brown Sofa, 3Pcs Camel and Dark Brown Faux Leather Sofa Set, Ash Loveseat, Asma Beige Sofa, Atlantic Chair, Asma Beige Loveseat, Abrianna Brown Love Seat, Alisa Sectional in Ivory, Abrianna Gray Sofa Set, Abrianna Gray Sofa, Atlantic Sofa Set, 3Pcs Black and White Faux Leather Sofa Set, Basix Portico 2Pcs Dining Chair in Off White, Aislin Espresso Love Seat, Bed Bench in Vintage Cream, Ash Chair, 3Pcs Dark Gray Leather Air Fabric Sofa Set","3Pcs Dark Gray Leather Air Fabric Sofa Set. Aislin Espresso Ottoman. Atlantic Chair. AccessoriesBedroomClearanceDining RoomLiving RoomMattressNew ArrivalsOfficeOutdoorYouth. 3Pcs White Microfiber Leather Sofa Set. Asma Beige Sofa. 3Pcs Cream Faux Leather Sofa Set. 3Pcs Purple Fabric Sofa Set. Low to high. Alisa Sectional in Ivory. Bed Bench in Vintage Cream. 3Pcs Rose Gold Faux Leather Sofa Set. 3Pcs Dark Chocolate and Cream Faux Leather Sofa Set. 3Pcs Taupe Microfiber Leather Sofa Set. 6Pcs Sectional Set in Grey. Augustina Light Brown Love Seat. Augustina Light Brown Chair. Ash Sofa. 2Pcs Mid-Century Dining Chair. Atlantic Loveseat. Amaris Dark Brown Recliner. Sign up to receive exclusive news, coupons, and deals. Ash Loveseat. Amaris Dark Brown Loveseat. Abrianna Brown Sofa. Ash Chair. Badalona I Beige Love Seat. Anita Espresso Power Love Seat w/ Console. 3Pcs Camel and Dark Brown Faux Leather Sofa Set w/ Coffee Table. Sign Up For Our Newsletters. See All Reviews. Accent Chair in Indigo. Atlantic Sofa SetMore options →. High to low. Write a review. Abrianna Gray Love Seat. Asma Beige Loveseat. Abrianna Gray Sofa Set. 3Pcs Dark Brown Faux Leather Sofa Set. Abrianna Brown Sofa Set. Abrianna Gray Sofa. Aislin Espresso Chair. Badalona I Grey Love Seat. More options →. Amaris Dark Brown Sofa. User’s Instructions & Terms. Augustina Light Brown Sofa. Ash Sofa Set. Basix Portico 2Pcs Dining Chair in Off White. Aislin Espresso Love Seat. Help With My Order. Atlantic Sofa Set. Alicia Light Brown Love Seat. Augustina Light Brown Sofa Set. Abrianna Brown Love Seat. Amaris Dark Brown Sofa Set. Asma Beige Sofa Set. Azis Gray Fabric Love Seat. 3Pcs Black and White Faux Leather Sofa Set"
https://24estyle.com/products/eliza-fan,Demo Cabang Pragmatic Play Gacor Akun Demo Olympus 1000 Gratis Gampang Menang,"Live Chat (24 Jam). Fashion & Aksesoris Anak. Peralatan Dapur Kecil. Order & Pembayaran. Voucher & Diskon. Demo Cabang Pragmatic Play Gacor Akun Demo Olympus 1000 Gratis Gampang MenangLOGINDAFTAR. Aksesoris Interior Mobil. Akun Demo Pragmatic. Penghisap Debu & Perawatan Lantai. Keperluan Rumah & Gaya Hidup. Perlengkapan Berkendara & Helm. Pakaian & Aksesoris. Pulsa & Tagihan. Merek:Demo Pragmatic Play. Kesehatan & Kecantikan. Olahraga & Outdoor. Jam Tangan Anak. Intellectual Property Protection. Jual Di Lazada. Ban & Velg Mobil. Mainan Olahraga & Luar Ruangan. Jam Tangan Wanita. Perkakas & Perbaikan Rumah. Kebijakan Produk Internasional. Aksesoris Hewan Peliharaan. Ibu & Anak. Pakaian Anak Perempuan. Penyejuk dan Pembersih Udara. Media, Musik & Buku. Bahan & Bumbu Masakan. Alat Tulis & Kerajinan. Olympus Super Scatter. Link Jamin Maxwin. Gym, Yoga & Fitness. Jasa Pengiriman. Kebutuhan Rumah Tangga. Popok Sekali Pakai. Layanan Pelanggan. Lingerie, Baju Tidur & Santai. Press & Media. Perlengkapan Sepak Bola. Baju Olahraga Pria. Fashion & Aksesoris Pria. Jelajahi Lazada. Metode Pembayaran. Sepatu Anak Perempuan. Makanan Sarapan, Sereal & Selai. Kamera Mobil, Audio & Video. Daftar Menang Berapapun Pasti di bayar:Banyak BonusnyaProduk Eksklusif di AppRekomendasiPermainan. Fashion & Aksesoris Wanita. Aksesoris Exterior Mobil. Makanan Bayi & Balita. Lazada Southeast Asia. Sepatu Olahraga Pria. Kesehatan Hewan Peliharaan. Elektronik Rumah Besar. Aksesoris & Elektronik Motor. Pakaian Anak Muslim Perempuan. Sepatu Olahraga Wanita. Aksesoris & Suku Cadang. Suku Cadang & Peralatan Mobil. Perawatan & Pengkilat Mobil. Jam Tangan Pria. Mainan Elektronik & RC. Alat Perawatan Diri. Bayi & Mainan. Follow Us. Wishlist dan Toko yang Saya Ikuti. Buah & Sayur. Makanan Hewan Peliharaan. Ban, Velg, Oli & Cairan Motor. Demo Cabang Pragmatic Play Gacor Akun Demo Olympus 1000 Gratis Gampang Menang. Baju Olahraga Wanita. Pengembalian & Pembatalan. TV & Perangkat Video. Pakaian Anak Muslim Laki-Laki. Binatu & Alat Kebersihan. Cokelat, Camilan & Permen. Pakaian Anak Laki-laki. TV & Elektronik Rumah. Pengembalian Barang & Dana. Camping dan Hiking. Demo Pragmatic Play. Verified by. Kebun & Luar Ruangan. Sepatu Anak Laki-laki. Oli & Cairan Mobil. Syarat & Ketentuan. Kelengkapan Tempat Tidur. Situs Demo olympus. Mainan Bayi & Balita. Suku Cadang & Peralatan Motor"
https://allwoodfurn.com/products/group-119-rustic-two-tone-gathering-table-and-barstools,Group #119,What's New. Your Cart is Empty. Request a quote. News & Updates. Ecommerce Software by Shopify. Group #119
https://americanbackyard.com/products/gift-card,Gift Card,Share on Pinterest. Share on Facebook. SaleLayer 1Sold Out. Gift Card. Layer 1Sold Out. Share on Twitter. Social Sharing. Cart ErrorAdd to CartAdded
https://asplundstore.se/products/fish-bricka,"Fish bricka vit, Fish brickor",FelKvantiteten måste vara 1 eller mer. SäljareASPLUND StoreOrdinarie pris275 krKampanjpris275 krOrdinarie prisErbjudandeSlutsåldEnhetspris/per. Fish brickor. Kvantiteten måste vara 1 eller mer. Lägg i varukorg. SizeSmallLargeSmallLarge - SlutsåldKvantitetFelKvantiteten måste vara 1 eller merLägg i varukorg. Fish brickorFish bricka storFish bricka litenFish bricka vit. Fish bricka vit. Fish bricka liten. Fish bricka stor. SmallLarge - Slutsåld
https://barnabylane.com.au/products/spensley-tan,"Spensley Dining Chair - Tan, Spensley Dining Chair - Rose Blush, Tanner Armchair - Tan, Kent Bench - Rose Blush",Smith Full Leather - Tan. Kent Bench - Rose Blush. You may also like. Spensley Dining Chair - Rose Blush. Smith Full Leather - Black. Tanner Armchair - Tan. Spensley Dining Chair - Tan
https://big-sale-furniture.com/products/amsterdam-bench-150-x-35-be-150-35-ta,Amsterdam Bench 150 x 35 cm BE-150-35-TA ( Chocolate Colour ),TweetTweet on Twitter. Previous slide. ShareShare on Facebook. Previous slideNext slide. Add to cart. Product Code:. Next slide. Default Title. Pin itPin on Pinterest. Amsterdam Bench 150 x 35 cm BE-150-35-TA ( Chocolate Colour ). Default TitleAdd to cart
https://candb.ca/products/10-gel-memory-foam-mattress,The Upton Mattress,Canadian Made. The Upton Mattress
https://classicwithatwist.com.au/products/1900-bench,"1900 BENCH, 1900 ARMCHAIR, 1900 CHAIR","Size:SizeL:106 W:53 H:90L:106 W:53 H:90L:106 W:53 H:90. LOUNGE CHAIRS & SOFAS. Add to cart. Skip to content. 01-COTTON WHITE. Pairs Well With. Color:01-COTTON WHITE. Classic with a Twist. 1/36 Doggett St, Fortitude Valley QLD 4006. 1900 ARMCHAIR. STOOLS & BENCHES. 731-733 High St, Armadale VIC 3143. TABLE & FLOOR. Enquire Now. TERMS & CONDITIONS. COFFEE & SIDE TABLES. PENDANT & WALL. PRODUCT CARE & WARRANTY. Quick view. 1900 CHAIR. 1900 BENCH. Quantity:Decrease quantityIncrease quantity. Quick viewQuick view"
https://craftassociatesfurniture.com/products/craft-associates-wool-lounge-chairs-1519,Canadian Modern Lounge Chairs - 1519,"Demo SubMenu 2. Milo Baughman Vintage Catalogue for Directional - chairs, credenzas, chests. Canadian Modern Lounge Chairs - 1519. Demo Submenu 3. Adrian Pearsall Vintage Catalogue. Lawrence Peabody Chairs, Sofa's, Selig collection, Nemchoff collection"
https://cultdesign.co.nz/products/molloy-chair,"Molloy Chair, Molloy ChairNau",- Download sustainability credentials. Download NAU Standards Finishes and Upholstery Overview. Choose your options. - Download technical drawings. Molloy ChairNau. TIMBERChoose TimberAshBlack Stained AshOakWalnut. - Download 3D Files. Molloy ChairNauRegular priceEstimated lead time 8 weeksIn stock. Enquire Now. In stockEstimated lead time 8 weeksTIMBERChoose TimberAshBlack Stained AshOakWalnutAshBlack Stained AshOakWalnutDownload Finishes and Upholstery Overview. Download Finishes and Upholstery Overview. Choose TimberAshBlack Stained AshOakWalnut. Regular price. Pin itPin on Pinterest. AshBlack Stained AshOakWalnut. Quantity must be 1 or more. - Download NAU finish guide. ShareShare on Facebook. By Adam Goodrum. - Download product sheet. - Download Care & Maintenance guide
https://decorium.us/products/costa-adjustable-barstool,"Dining Room Storage, Dana Modern Adjustable Barstool, Walnut Adjustable Barstool in Black or Ecru, Costa Adjustable Barstool, Mid Century Modern Adjustable Barstool in Black or Ecru, Dining Room Collections, Follow Us, Digial Media Run, Beige Fabric Stool with Black Metal in Counter or Bar Height, Add to wishlist, Store Hours:, Lounge & Swings, Grey Mid Century Stool in Counter or Bar Height, Xara Velvet Stool with Gold Legs in 6 Color Options, Bruso Upholstered Adjustable Barstool, Circa Modern Adjustable Barstool, Mya Velvet Swivel Stool in 3 Colors Options, Accents & Accessories, Exposed Wood Adjustable Barstool in Black or Ecru, Chip Modern Backless Adjustable Barstool, View full product details →, Living Room Furniture, QuantityUnavailableSold Out, Related Products, Luxe Stool in Bar or Counter Height, Walnut Wave-Like Barstool, Powered by Shopify, Benches & Ottomans, Grey Velvet Stool with Gold Metal in Counter or Bar Height, Clay Modern Adjustable Barstool, Add to cart, Xara Velvet Stool with Chrome Legs in 3 Color Options, White Round Backless Stool in Counter or Bar Height, TypeBar Stools, Product DescriptionCustomer Review, Raymond Antique Dual Tone Bar, Betsy Velvet Stool in Counter or Bar Height, Store Hours:Store Hours:Monday to Saturday - 10 AM to 6 PMTuesday and Sunday Closed, Oahu Modern Backless Adjustable Barstool, Share this product, TypeBar StoolsVendorElite Modern, VendorElite Modern",Xara Velvet Stool with Chrome Legs in 3 Color Options. Betsy Velvet Stool in Counter or Bar Height. Dining Room Collections. Add to cart. Accents & Accessories. Exposed Wood Adjustable Barstool in Black or Ecru. Clay Modern Adjustable Barstool. Raymond Antique Dual Tone Bar. Digial Media Run. Xara Velvet Stool with Gold Legs in 6 Color Options. Costa Adjustable Barstool. Share this product. Walnut Adjustable Barstool in Black or Ecru. Dana Modern Adjustable Barstool. Circa Modern Adjustable Barstool. Related Products. Product DescriptionCustomer Review. Beige Fabric Stool with Black Metal in Counter or Bar Height. Dining Room Storage. QuantityUnavailableSold Out. Grey Velvet Stool with Gold Metal in Counter or Bar Height. Luxe Stool in Bar or Counter Height. Oahu Modern Backless Adjustable Barstool. Follow Us. View full product details →. Walnut Wave-Like Barstool. Grey Mid Century Stool in Counter or Bar Height. Store Hours:. Living Room Furniture. TypeBar StoolsVendorElite Modern. Store Hours:Store Hours:Monday to Saturday - 10 AM to 6 PMTuesday and Sunday Closed. Lounge & Swings. Powered by Shopify. Benches & Ottomans. Add to wishlist. Bruso Upholstered Adjustable Barstool. VendorElite Modern. TypeBar Stools. Chip Modern Backless Adjustable Barstool. Mid Century Modern Adjustable Barstool in Black or Ecru. Mya Velvet Swivel Stool in 3 Colors Options. White Round Backless Stool in Counter or Bar Height
https://dfohome.com/products/patio-furniture/swings/all-swings,"DURAWOOD® Poly Porch Swingby Pawleys Island, Deluxe Polyester Rope Swing Chair - Oatmealby Castaway Living, Deluxe Sunbrella Cushion Swing - Regency Sandby Hatteras Hammocks, DURACORD® Single Rope Swing - Antique Brown, Tufted Sunbrella Single Swing - Adaption Apricotby Hatteras Hammocks, Tufted Sunbrella Single Swing - Cast Slateby Hatteras Hammocks, Deluxe Sunbrella Cushion Swing - Midori Indigo, Tufted Sunbrella Single Swing - Resonate Atlantisby Hatteras Hammocks, Deluxe Sunbrella Cushion Swing - Cast Slateby Hatteras Hammocks, Deluxe Cotton Rope Swing Chair, Deluxe Sunbrella Cushion Swing - Regency Sand, Deluxe Polyester Rope Swing Chair - Navy, Tufted Sunbrella Single Swing - Resonate Atlantis, Deluxe Polyester Rope Swing Chair - Antique Brownby Key West Hammocks, Premium Sunbrella Tufted Single Swing - Scale Taupeby Hatteras Hammocks, Single Cotton Rope Swingby Pawleys Island, Sunbrella® Deluxe Cushion Swing - Spectrum Cilantroby Hatteras Hammocks, Single Cushioned Swing - Gray and Black Stripeby Castaway Living, DURACORD® Single Rope Swing - White, Single Cushioned Swing with Swing Spring, Deluxe Pillowtop Swing With Quick Dry Fabric - Tropical Printby Key West Hammocks, Sunbrella Cushioned Single Swing - Cove Pebbleby Pawleys Island, Tufted Sunbrella Single Swing - Canvas Cocoa, DURAWOOD® Poly White Coastal DURACORD® Rope Double Swingby Pawleys Island, Deluxe Sunbrella Cushion Swing - Gateway Mistby Hatteras Hammocks, Tufted Cushioned Swing with Swing Spring, Deluxe Premium Sunbrella Cushion Swing - Midori Stone, Deluxe Sunbrella Cushion Swing - Gateway Indigo, DURACORD® Single Rope Swing - Greenby Pawleys Island, Tufted Sunbrella Cushioned Single Swing - Principle Lagoonby Pawleys Island, Deluxe Polyester Rope Swing Chair - Greenby Key West Hammocks, Deluxe Sunbrella Cushion Swing - Cast Ashby Hatteras Hammocks, DURACORD® Single Rope Swing - Oatmeal, Deluxe Pillowtop Swing With Quick Dry Fabric - Yellow Multicolor Stripeby Key West Hammocks, Single Cushioned Swing - Blue and Green Stripeby Castaway Living, Single Cushioned Swing with Swing Springby Pawleys Island, DURACORD® Single Rope Swing - Green, Single Rope Swing with Swing Springby Pawleys Island, Sunbrella Cushioned Single Swing - Expand Dove, Deluxe Sunbrella Cushion Swing - Cast Slate, Sunbrella Cushioned Single Swing - Trusted Coastby Pawleys Island, Single Cushioned Swing - Fruit Punch, Deluxe Sunbrella Cushion Swing - Cabana Black, Single Cushioned Swing - Fruit Punchby Key West Hammocks, Deluxe Cotton Rope Swing Chairby Key West Hammocks, Deluxe Sunbrella Cushion Swing - Gateway Indigoby Hatteras Hammocks, Single Cushioned Swing - Gray and Black Stripe, Deluxe Polyester Rope Swing Chair - Antique Brown, Deluxe Sunbrella Cushion Swing - Cabana Blackby Hatteras Hammocks, Deluxe Sunbrella Cushion Swing - Gateway Mist, Tufted Sunbrella Cushioned Single Swing - Principle Lagoon, Tufted Sunbrella Single Swing - Adaption Apricot, Tufted Sunbrella Cushioned Single Swing - Trusted Coastby Pawleys Island, Single Cushioned Swing - Blue and Green Stripe, Tufted Sunbrella Cushioned Single Swing - Trusted Coast, Single Rope Swing with Swing Spring, Sunbrella Cushioned Single Swing - Cove Pebble, Deluxe Polyester Rope Swing Chair - Navyby Key West Hammocks, Tufted Sunbrella Cushioned Single Swing - Cove Pebble, Sunbrella Cushioned Single Swing - Expand Doveby Pawleys Island, Deluxe Sunbrella Cushion Swing - Cast Ash, Sunbrella Cushioned Single Swing - Expand Citronelle, Deluxe Polyester Rope Swing Chair - Oatmeal, Tufted Sunbrella Single Swing - Cast Ashby Hatteras Hammocks, Tufted Bella Dura Cushioned Single Swing - Atoll Royalty, DURAWOOD® Poly White Coastal DURACORD® Rope Double Swing, Sunbrella Cushioned Single Swing - Trusted Coast, DURACORD® Single Rope Swing - Whiteby Pawleys Island, Tufted Sunbrella Single Swing - Luxe Indigo, Tufted Sunbrella Single Swing - Cast Ash, Premium Sunbrella Tufted Single Swing - Scale Taupe, DURAWOOD® Poly Cedar Coastal DURACORD® Double Swingby Pawleys Island, Tufted Bella Dura Cushioned Single Swing - Atoll Royaltyby Pawleys Island, Deluxe Premium Sunbrella Cushion Swing - Midori Stoneby Hatteras Hammocks, Tufted Sunbrella Single Swing - Canvas Cocoaby Hatteras Hammocks, Deluxe Sunbrella Cushion Swing - Midori Indigoby Hatteras Hammocks, DURAWOOD® Poly Cedar Coastal DURACORD® Double Swing, Tufted Sunbrella Cushioned Single Swing - Cove Pebbleby Pawleys Island, Tufted Sunbrella Single Swing - Integrated Pewter, Tufted Cushioned Swing with Swing Springby Pawleys Island, Deluxe Polyester Rope Swing Chair - Green, DURACORD® Single Rope Swing - Oatmealby Pawleys Island, Tufted Sunbrella Single Swing - Luxe Indigoby Hatteras Hammocks, Deluxe Pillowtop Swing With Quick Dry Fabric - Tropical Print, DURAWOOD® Poly Porch Swing, Childrens South American Fabric Swing - Greenby Key West Hammocks, Tufted Sunbrella Single Swing - Cast Slate, Sunbrella® Deluxe Cushion Swing - Spectrum Cilantro, DURACORD® Single Rope Swing - Antique Brownby Pawleys Island, DURAWOOD® Poly Weatherwood Coastal DURACORD® Rope Double Swingby Pawleys Island, DURAWOOD® Poly Weatherwood Coastal DURACORD® Rope Double Swing, Deluxe Pillowtop Swing With Quick Dry Fabric - Yellow Multicolor Stripe, Tufted Sunbrella Single Swing - Integrated Pewterby Hatteras Hammocks","Gifts by DFO. Tufted Sunbrella Single Swing - Cast Slate. (252) 295-0404M - F 8:00am - 4:30pm. Sunbrella Cushioned Single Swing - Cove Pebbleby Pawleys Island. Add a Coupon. Tempotest Outdoor Curtains. Tufted Sunbrella Single Swing - Cast Slateby Hatteras Hammocks. Polyester Outdoor Curtains. Hammocks Made in USA. Tufted Cushioned Swing with Swing Spring. Sunbrella Cushioned Single Swing - Trusted Coast. Tufted Sunbrella Single Swing - Adaption Apricotby Hatteras Hammocks. Sunbrella Cushioned Single Swing - Trusted Coastby Pawleys Island. Shop All Hammocks. Sunbrella Outdoor Pillows. Double Adirondack Chairs. Heating & Lighting. Outdoor Heating. Single Rope Swing with Swing Springby Pawleys Island. by Castaway Living. Deluxe Polyester Rope Swing Chair - Green. Deluxe Polyester Rope Swing Chair - Antique Brown. More Ways to Shop Overview. Made in the USA. Outdoor Pillows by Style. Deluxe Sunbrella Cushion Swing - Cabana Blackby Hatteras Hammocks. Deluxe Sunbrella Cushion Swing - Cabana Black. Shop Clearance Pillows. Shop All Outdoor Pillows >. USA-Made Outdoor Pillows. Deluxe Premium Sunbrella Cushion Swing - Midori Stone. Deluxe Polyester Rope Swing Chair - Greenby Key West Hammocks. Deluxe Polyester Rope Swing Chair - Antique Brownby Key West Hammocks. Deluxe Pillowtop Swing With Quick Dry Fabric - Yellow Multicolor Stripe. Single Cushioned Swing - Gray and Black Stripeby Castaway Living. Deluxe Sunbrella Cushion Swing - Gateway Mistby Hatteras Hammocks. Decorative Outdoor Lighting. Tufted Sunbrella Cushioned Single Swing - Cove Pebble. DURAWOOD® Poly Porch Swing. Deluxe Pillowtop Swing With Quick Dry Fabric - Tropical Print. More Ways to Shop. Tufted Sunbrella Cushioned Single Swing - Trusted Coastby Pawleys Island. DURACORD® Single Rope Swing - Greenby Pawleys Island. Shop All Clearance. Shop All Outdoor Pillows. Deluxe Polyester Rope Swing Chair - Oatmeal. Tufted Sunbrella Single Swing - Integrated Pewter. Tufted Bella Dura Cushioned Single Swing - Atoll Royalty. Umbrella Bases and More. Sunbrella Cushioned Single Swing - Expand Citronelleby Pawleys Island. Returns & Exchanges. Tracking / Order Status. Striped Outdoor Curtains. DURACORD® Single Rope Swing - White. 120"" Extra Wide Outdoor Curtains. Single Cushioned Swing - Fruit Punch. Outdoor Pillow Sets. Hammock Accessories. Deluxe Polyester Rope Swing Chair - Navy. Sunbrella Cushioned Single Swing - Expand Doveby Pawleys Island. Outdoor Curtains Overview. Family of Stores. Outdoor Specialty Lamps. Tufted Bella Dura Cushioned Single Swing - Atoll Royaltyby Pawleys Island. Shop All Outdoor Curtains >. Sheer Outdoor Curtains. Solid Outdoor Curtains. DURAWOOD® Poly Porch Swingby Pawleys Island. Tufted Sunbrella Cushioned Single Swing - Principle Lagoonby Pawleys Island. DURAWOOD® Poly Cedar Coastal DURACORD® Double Swing. Single Cushioned Swing - Fruit Punchby Key West Hammocks. Floral Outdoor Pillows. Deluxe Sunbrella Cushion Swing - Cast Ash. Striped Outdoor Pillows. Polyester Outdoor Pillows. Tufted Sunbrella Cushioned Single Swing - Trusted Coast. Single Cushioned Swing - Blue and Green Stripeby Castaway Living. Fire Pit Accessories. Premium Sunbrella Tufted Single Swing - Scale Taupeby Hatteras Hammocks. Dining Chair Cushions. DURACORD® Single Rope Swing - Green. Press & Media. Shop Clearance Curtains. Deluxe Polyester Rope Swing Chair - Oatmealby Castaway Living. Deluxe Pillowtop Swing With Quick Dry Fabric - Yellow Multicolor Stripeby Key West Hammocks. Extra Wide Hammocks. Weathersmart Outdoor Curtains. Wall & Ceiling Lighting. Tufted Sunbrella Single Swing - Canvas Cocoaby Hatteras Hammocks. Novelty Outdoor Pillows. Outdoor Pillows by Type. Single Cushioned Swing - Gray and Black Stripe. DURACORD® Single Rope Swing - Whiteby Pawleys Island. Tufted Sunbrella Cushioned Single Swing - Principle Lagoon. Wooden Adirondack Chairs. Outdoor Curtains by Color. Pets Outdoor Seating. Deluxe Sunbrella Cushion Swing - Midori Indigoby Hatteras Hammocks. Outdoor Seating. Solid Outdoor Pillows. Patio Furniture. Seasonal Outdoor Pillows. Deluxe Sunbrella Cushion Swing - Gateway Mist. Sunbrella® Deluxe Cushion Swing - Spectrum Cilantroby Hatteras Hammocks. Conditions of Use. Shop Clearance Hammocks. Outdoor Side & End Tables. Single Rope Swing with Swing Spring. Beach Outdoor Pillows. Tufted Sunbrella Cushioned Single Swing - Cove Pebbleby Pawleys Island. Patterned Outdoor Pillows. Hammock Storage Bags. Hammock Type. Single Cotton Rope Swing. Single Cotton Rope Swingby Pawleys Island. Deluxe Sunbrella Cushion Swing - Cast Slateby Hatteras Hammocks. Tufted Sunbrella Single Swing - Luxe Indigoby Hatteras Hammocks. Outdoor Floor Lamps. Good Better Best. Porch Swings. Grommet Top Outdoor Curtains. Sunbrella Cushioned Single Swing - Expand Citronelle. Deluxe Cotton Rope Swing Chairby Key West Hammocks. DURAWOOD® Poly White Coastal DURACORD® Rope Double Swing. Poly Lumber Adirondack Chairs. Furniture Sets. Shop All Outdoor Cushions. Tufted Sunbrella Single Swing - Luxe Indigo. Sunbrella Cushioned Single Swing - Cove Pebble. Tufted Sunbrella Single Swing - Adaption Apricot. DURAWOOD® Poly Cedar Coastal DURACORD® Double Swingby Pawleys Island. Shop All Outdoor Seating. South American Hammocks. Tufted Sunbrella Single Swing - Resonate Atlantisby Hatteras Hammocks. 50"" Wide Outdoor Curtains. DURACORD® Single Rope Swing - Oatmeal. Children's South American Fabric Swing - Green. Children's South American Fabric Swing - Greenby Key West Hammocks. Shop Outdoor Pillow Sets. Solution Dyed Fabric Hammocks. DURAWOOD® Poly Weatherwood Coastal DURACORD® Rope Double Swingby Pawleys Island. Shop All Patio Furniture Accessories. DURACORD® Single Rope Swing - Antique Brown. Price Range. Deep Seating Cushions. Outdoor Dining. Outdoor Coffee Tables. Outdoor Pillows by Color. DURAWOOD® Poly Weatherwood Coastal DURACORD® Rope Double Swing. Our Company. Tufted Sunbrella Single Swing - Integrated Pewterby Hatteras Hammocks. Shop All Patio Furniture Sets. Single Cushioned Swing - Blue and Green Stripe. Sunbrella Outdoor Curtains. Hammocks With Stands. Tufted Sunbrella Single Swing - Resonate Atlantis. Patio Furniture Overview. Deluxe Sunbrella Cushion Swing - Cast Ashby Hatteras Hammocks. Tufted Sunbrella Single Swing - Cast Ashby Hatteras Hammocks. Shop All Stands. Outdoor Square Pillows. Outdoor Curtain Hardware. Shop All Brands. Commercial Use. Tufted Sunbrella Single Swing - Canvas Cocoa. Deluxe Sunbrella Cushion Swing - Gateway Indigo. Outdoor Lumbar Pillows. Single Cushioned Swing with Swing Spring. Shop Brands. Shop All Outdoor Tables. by Pawleys Island. Expert Advice. by Key West Hammocks. Shop All Swings. by Hatteras Hammocks. DURACORD® Single Rope Swing - Antique Brownby Pawleys Island. Shop All Outdoor Heating. Kids Outdoor Seating. View Cart & Checkout. Deluxe Premium Sunbrella Cushion Swing - Midori Stoneby Hatteras Hammocks. Outdoor Wall Art. Deluxe Sunbrella Cushion Swing - Midori Indigo. Tufted Cushioned Swing with Swing Springby Pawleys Island. DURACORD® Single Rope Swing - Oatmealby Pawleys Island. Deluxe Sunbrella Cushion Swing - Cast Slate. Outdoor Dining Tables. Shop Clearance Furniture. Sunbrella Cushioned Single Swing - Expand Dove. Sunbrella® Deluxe Cushion Swing - Spectrum Cilantro. Outdoor Conversation Tables. Outdoor Swings. Outdoor Kids Tables. HomeProductsPatio FurnitureSwings. Single Cushioned Swing with Swing Springby Pawleys Island. Shop All Outdoor Lighting. Deluxe Pillowtop Swing With Quick Dry Fabric - Tropical Printby Key West Hammocks. Outdoor Table Lamps. Premium Sunbrella Tufted Single Swing - Scale Taupe. Made in USA. Tab Top Outdoor Curtains. DURAWOOD® Poly White Coastal DURACORD® Rope Double Swingby Pawleys Island. Deluxe Cotton Rope Swing Chair. Deluxe Sunbrella Cushion Swing - Gateway Indigoby Hatteras Hammocks. Outdoor Pillows Overview. Shop All Furniture Sets. Shop All Hammock Accessories. Deluxe Sunbrella Cushion Swing - Regency Sand. Deluxe Sunbrella Cushion Swing - Regency Sandby Hatteras Hammocks. Tufted Sunbrella Single Swing - Cast Ash. Deluxe Polyester Rope Swing Chair - Navyby Key West Hammocks. Heating & Lighting Overview"
https://dhfonline.com/products/gift-card,Gift Card,TweetTweet on Twitter. ShareShare on Facebook. Pin itPin on Pinterest. Unit price/per. Gift Card. We Also Recommend
https://dunlin.com.au/products/beadlight-cirrus,Beadlight Cirrus LED Reading Light,Beadlight Cirrus LED Reading Light. Related products
