URL,Informative_Text,Texts
https://mintffe.com.au/products/?product-page=12,"Digital Print Table Tops, Doc, Doc Armchair, Doc Bar Stool, Dock Table Base, Doga Armchair, Doga Bar Stool, Doga Bistrot, Doga Relax, Doga Side Table, Dolcevita PL01, Dolcevita PO01, Dover Bar Stool, Dream Folding Chair, Drift Armchair, Drift Chair, Drop Bar Stool, Drop Chair, Eau Rouge, Eau Rouge Armchair, Echo Armchair, Eddie Bar Stool, Eddie Chair, Elbow Armchair","Dover Bar StoolElevate your bar area with the Dover Bar…Enquire Now. Doga Armchair. Doga Bar Stool. Dolcevita is ideal for terraces, verandas and covered…. Stand out with our range of Digital Print…. Dream Folding ChairThe Dream folding chair is a contemporary polypropylene…. Drift ChairEnquire Now. Designed to immediately catch people’s eye as they…. Drift Chair. Eddie Bar StoolEddie's contemporary black frame makes it ideal for…. Digital Print Table TopsStand out with our range of Digital Print…Enquire Now. Doga Bistrot. Fresh, light and ergonomic, Doga Armchair is for…. Doga RelaxFresh, light and ergonomic, the Doga Relax armchair…Enquire Now. Drop Bar StoolDrop is characterised by lightweight, resistance to light…. Eddie Bar StoolEddie's contemporary black frame makes it ideal for…Enquire Now. Dolcevita PL01. Dover Bar StoolElevate your bar area with the Dover Bar…. Elbow ArmchairThe Elbow Dining Chair is a classic design…. DocDesigned to immediately catch people’s eye as they…Enquire Now. Dolcevita PO01Dolcevita is ideal for terraces, verandas and covered…. The Elbow Dining Chair is a classic design…. Echoing a classic era this armchair is fully…. Eau Rouge ArmchairEau Rouge stems from the desire to design…Enquire Now. Dream Folding Chair. Doga RelaxFresh, light and ergonomic, the Doga Relax armchair…. Digital Print Table Tops. Fresh, light and ergonomic, the Doga Bar Stool…. Dream Folding ChairThe Dream folding chair is a contemporary polypropylene…Enquire Now. Drift Armchair. Digital Print Table TopsStand out with our range of Digital Print…. Eddie ChairEddie's contemporary black frame makes it ideal for…. Echo ArmchairEchoing a classic era this armchair is fully…. Doga BistrotFresh, light and ergonomic, the Doga side chair…. Drop is characterised by lightweight, resistance to light…. Doga Side TableThe slatted design is given a contemporary look…. Eau Rouge Armchair. Dolcevita PO01. Elbow ArmchairThe Elbow Dining Chair is a classic design…Enquire Now. Doga Side Table. Eau RougeEau Rouge stems from the desire to design…. Eddie Chair. Doc Armchair. Drop Chair. Dover Bar Stool. Doga Relax. Filter by. DocDesigned to immediately catch people’s eye as they…. Doc Bar StoolDesigned to immediately catch people’s eye as they…Enquire Now. Fresh, light and ergonomic, the Doga Relax armchair…. Dolcevita PL01Dolcevita is ideal for terraces, verandas and covered…. Dock Table Base. Echo Armchair. Eddie's contemporary black frame makes it ideal for…. Doga Bar StoolFresh, light and ergonomic, the Doga Bar Stool…. Doga Side TableThe slatted design is given a contemporary look…Enquire Now. Eddie ChairEddie's contemporary black frame makes it ideal for…Enquire Now. Eau Rouge. Doc ArmchairDesigned to immediately catch people’s eye as they…Enquire Now. Doga BistrotFresh, light and ergonomic, the Doga side chair…Enquire Now. Dock Table BaseThe Dock Table base combines the strength of…Enquire Now. Drop ChairDrop is characterised by lightweight, resistance to light…Enquire Now. Drop Bar StoolDrop is characterised by lightweight, resistance to light…Enquire Now. Eau Rouge ArmchairEau Rouge stems from the desire to design…. Elbow Armchair. Eddie Bar Stool. Dolcevita PL01Dolcevita is ideal for terraces, verandas and covered…Enquire Now. Drop Bar Stool. Drop ChairDrop is characterised by lightweight, resistance to light…. The Dream folding chair is a contemporary polypropylene…. Drift ArmchairEnquire Now. Doc Bar Stool. Doga ArmchairFresh, light and ergonomic, Doga Armchair is for…. The slatted design is given a contemporary look…. Dock Table BaseThe Dock Table base combines the strength of…. Dolcevita PO01Dolcevita is ideal for terraces, verandas and covered…Enquire Now. Eau Rouge stems from the desire to design…. The Dock Table base combines the strength of…. Doga ArmchairFresh, light and ergonomic, Doga Armchair is for…Enquire Now. Doc ArmchairDesigned to immediately catch people’s eye as they…. Echo ArmchairEchoing a classic era this armchair is fully…Enquire Now. Elevate your bar area with the Dover Bar…. Doc Bar StoolDesigned to immediately catch people’s eye as they…. Doga Bar StoolFresh, light and ergonomic, the Doga Bar Stool…Enquire Now. Eau RougeEau Rouge stems from the desire to design…Enquire Now. Fresh, light and ergonomic, the Doga side chair…"
https://mintffe.com.au/products/?product-page=13,"Elbow Dining Chair, Elena Bar Stool, Elena Dining Chair, Elia Armchair PO01, Elia Bar Stool SG01, Elia Lounge Chair PL01, Elio Coffee Table TC01, Elio Dining Table TV01, Elite Armchair, Elite Backless Bar Stool, Elite Bar Table, Elite Bench Set, Elite Lounge, Elite Table, Elle Coffee Table, Elms Armchair, Elouise Reclaimed Elm Timber Table, Eman, Eman Backless Bar Stool, Eman Bar Stool, Entree P, Époque Chair, Esplanade Self-Stabilising Counter/High Bar Base, Esplanade Self-Stabilising Table Base","Elite TableElite is a collection assimilating obsessive attention to…Enquire Now. Elite ArmchairThe Elite range has a lightweight aluminium frame…. EmanResistant and minimal, the Eman stool immediately takes…Enquire Now. design Gian Luca Tonelli / Davide Carlesi Entree…. Classic and architectural, the NOROCK Esplanade self-stabilising base exemplifies…. Elite Bench SetThe Elite range has an elegantly curved aluminium…Enquire Now. Elite Table. Eman Backless Bar StoolResistant and minimal, the Eman stool immediately takes…. Elia Bar Stool SG01design Marco Zito The Elia range is soft…. Elia Lounge Chair PL01. Elite ArmchairThe Elite range has a lightweight aluminium frame…Enquire Now. Elite LoungeThe Elite range has a lightweight aluminium frame…. Elena Dining ChairThe Elena Dining Chair epitomises elegance through its…Enquire Now. Elite is a collection assimilating obsessive attention to…. Elle Coffee TableThe Elle coffee table is testament to the…. Classic and architectural, the NOROCK Esplanade self-stabilising table base…. Esplanade Self-Stabilising Table BaseClassic and architectural, the NOROCK Esplanade self-stabilising table base…Enquire Now. Esplanade Self-Stabilising Table BaseClassic and architectural, the NOROCK Esplanade self-stabilising table base…. Époque Chair. Elite Bar TableElite is a collection assimilating obsessive attention to…. Elms ArmchairThe Elms armchair is a sophisticated chair with…. The Elbow Dining Chair is a classic design…. Elite Bar Table. Elio Coffee Table TC01design Marco Zito The Elia range is soft…. Elia Bar Stool SG01. Elouise Reclaimed Elm Timber TableThe Elouise is made from reclaimed Elm timber…. The Elena Bar Stool epitomises elegance through its…. Eman Backless Bar StoolResistant and minimal, the Eman stool immediately takes…Enquire Now. Époque ChairLike a line that never ends, the contours…Enquire Now. Like a line that never ends, the contours…. Elite Armchair. Elia Armchair PO01design Marco Zito The Elia range is soft…Enquire Now. Elite LoungeThe Elite range has a lightweight aluminium frame…Enquire Now. Elite TableElite is a collection assimilating obsessive attention to…. Elite Bench SetThe Elite range has an elegantly curved aluminium…. Elle Coffee Table. Elite Backless Bar StoolThe lightweight frame has clean, minimalistic design that…Enquire Now. Esplanade Self-Stabilising Table Base. Eman Bar StoolResistant and minimal, the Eman stool immediately takes…. Elite Lounge. The lightweight frame has clean, minimalistic design that…. Elouise Reclaimed Elm Timber TableThe Elouise is made from reclaimed Elm timber…Enquire Now. Eman Backless Bar Stool. The Elena Dining Chair epitomises elegance through its…. Esplanade Self-Stabilising Counter/High Bar BaseClassic and architectural, the NOROCK Esplanade self-stabilising base exemplifies…. EmanResistant and minimal, the Eman stool immediately takes…. Eman Bar StoolResistant and minimal, the Eman stool immediately takes…Enquire Now. Filter by. Elena Bar StoolThe Elena Bar Stool epitomises elegance through its…Enquire Now. The Elle coffee table is testament to the…. The Elms armchair is a sophisticated chair with…. Elia Armchair PO01. Elio Dining Table TV01. Elouise Reclaimed Elm Timber Table. design Marco Zito The Elia range is soft…. Elbow Dining ChairThe Elbow Dining Chair is a classic design…. Elena Bar Stool. Elia Lounge Chair PL01design Marco Zito The Elia range is soft…Enquire Now. Esplanade Self-Stabilising Counter/High Bar BaseClassic and architectural, the NOROCK Esplanade self-stabilising base exemplifies…Enquire Now. Eman Bar Stool. Elite Bench Set. The Elite range has an elegantly curved aluminium…. Entree Pdesign Gian Luca Tonelli / Davide Carlesi Entree…Enquire Now. Entree Pdesign Gian Luca Tonelli / Davide Carlesi Entree…. Elena Dining Chair. Elio Coffee Table TC01design Marco Zito The Elia range is soft…Enquire Now. Elite Bar TableElite is a collection assimilating obsessive attention to…Enquire Now. Entree P. Resistant and minimal, the Eman stool immediately takes…. Elms Armchair. Elbow Dining Chair. Elia Bar Stool SG01design Marco Zito The Elia range is soft…Enquire Now. Elia Lounge Chair PL01design Marco Zito The Elia range is soft…. Elena Bar StoolThe Elena Bar Stool epitomises elegance through its…. Elia Armchair PO01design Marco Zito The Elia range is soft…. Elbow Dining ChairThe Elbow Dining Chair is a classic design…Enquire Now. Époque ChairLike a line that never ends, the contours…. Esplanade Self-Stabilising Counter/High Bar Base. Elms ArmchairThe Elms armchair is a sophisticated chair with…Enquire Now. Elite Backless Bar Stool. Elena Dining ChairThe Elena Dining Chair epitomises elegance through its…. Elio Coffee Table TC01. The Elouise is made from reclaimed Elm timber…. Elite Backless Bar StoolThe lightweight frame has clean, minimalistic design that…. Elle Coffee TableThe Elle coffee table is testament to the…Enquire Now. The Elite range has a lightweight aluminium frame…"
https://mintffe.com.au/products/?product-page=14,"Etch Armchair, Etch Bar Stool, Ethel Dining Chair, Eyre Dining Chair, Falcon Wing Back Chair, Fawn Outdoor Bentwood Chair, Fawn Outdoor Bentwood Stool, Feast Banquet Table – Rectangle, Feast Banquet Table – Round, Felix Table Base, Finch Deluxe Dining Chair, Finch Dining Chair, Finch Side Chair, Finn All Wood Armchair, Finn All Wood Chair, Finn Armchair, Finn Chair, Finn Metal Wood, Finn Metal Wood Armchair, Finn Natural, Finn Natural Armchair, Finnley Dining Chair, Flap Armchair, Flap Modular Lounge","Finnley Dining ChairThe Finn range features a beautiful teak frame…Enquire Now. Finn All Wood Armchairdesign Marcello Ziliani Profiles with deliberately generous sections…Enquire Now. Finally, a range of bentwood chairs that are…. Finn Metal Wood Armchair. Fawn Outdoor Bentwood Stool. Flap Armchairdesign Meneghello Paolelli The Flap modular upholstered furniture…Enquire Now. Finn All Wood Armchair. Eyre Dining ChairClassic dining chair with hand-woven synthetic rattan and…. design Marcello Ziliani Profiles with deliberately generous sections…. Finch Deluxe Dining ChairYU-MT2084 The Finch Deluxe Dining Chair takes this…. Etch Bar StoolThis contemporary armchair with curved backrest and arms…Enquire Now. Eyre Dining Chair. design Meneghello Paolelli The Flap modular upholstered furniture…. Felix Table BaseThe Felix Range is a cheeky modern design…Enquire Now. YU-MT2083 The Finch Dining Chair is a perfect…. Pure polyethylene blow moulded top, shock proof and…. Etch Bar StoolThis contemporary armchair with curved backrest and arms…. Finch Side Chair. Etch Bar Stool. Finn Naturaldesign Marcello Ziliani Profiles with deliberately generous sections…Enquire Now. Ethel Dining ChairEthel has a powdercaoted steel frame and timber…Enquire Now. Finn Natural Armchair. Finch Dining ChairYU-MT2083 The Finch Dining Chair is a perfect…Enquire Now. Finn Naturaldesign Marcello Ziliani Profiles with deliberately generous sections…. Finch Deluxe Dining ChairYU-MT2084 The Finch Deluxe Dining Chair takes this…Enquire Now. Finn Metal Wooddesign Marcello Ziliani Profiles with deliberately generous sections…Enquire Now. Fawn Outdoor Bentwood ChairFinally, a range of bentwood chairs that are…. Finnley Dining Chair. Finn Natural Armchairdesign Marcello Ziliani Profiles with deliberately generous sections…. Finn Chairdesign Marcello Ziliani Profiles with deliberately generous sections…Enquire Now. YU-MT2082 The Finch Side Chair is a perfect…. Finn All Wood Chairdesign Marcello Ziliani Profiles with deliberately generous sections…Enquire Now. Finn Armchairdesign Marcello Ziliani Profiles with deliberately generous sections…. Finn All Wood Armchairdesign Marcello Ziliani Profiles with deliberately generous sections…. YU-MT2084 The Finch Deluxe Dining Chair takes this…. Feast Banquet Table – RectanglePure polyethylene blow moulded top, shock proof and…Enquire Now. Finnley Dining ChairThe Finn range features a beautiful teak frame…. Feast Banquet Table – RoundPure polyethylene blow moulded top, shock proof and…Enquire Now. Finn Armchair. Fawn Outdoor Bentwood StoolFinally, a range of bentwood chairs that are…Enquire Now. design Meneghello Paolelli Flap is a collection of…. Etch ArmchairThis contemporary armchair with curved backrest and arms…Enquire Now. This contemporary armchair with curved backrest and arms…. The Felix Range is a cheeky modern design…. Classic dining chair with hand-woven synthetic rattan and…. Filter by. Flap Armchairdesign Meneghello Paolelli The Flap modular upholstered furniture…. Flap Modular Loungedesign Meneghello Paolelli Flap is a collection of…Enquire Now. Finn Natural Armchairdesign Marcello Ziliani Profiles with deliberately generous sections…Enquire Now. Finch Side ChairYU-MT2082 The Finch Side Chair is a perfect…Enquire Now. Felix Table BaseThe Felix Range is a cheeky modern design…. Felix Table Base. The Finn range features a beautiful teak frame…. Falcon Wing Back Chair. Fawn Outdoor Bentwood ChairFinally, a range of bentwood chairs that are…Enquire Now. Finn Armchairdesign Marcello Ziliani Profiles with deliberately generous sections…Enquire Now. Finn Metal Wood Armchairdesign Marcello Ziliani Profiles with deliberately generous sections…. Finch Deluxe Dining Chair. Fawn Outdoor Bentwood Chair. Ethel has a powdercaoted steel frame and timber…. Flap Armchair. Finch Side ChairYU-MT2082 The Finch Side Chair is a perfect…. Finn Natural. Flap Modular Lounge. Feast Banquet Table – RoundPure polyethylene blow moulded top, shock proof and…. Finn Chairdesign Marcello Ziliani Profiles with deliberately generous sections…. Feast Banquet Table – Round. Finn All Wood Chair. Finch Dining Chair. Finch Dining ChairYU-MT2083 The Finch Dining Chair is a perfect…. Ethel Dining ChairEthel has a powdercaoted steel frame and timber…. Finn Metal Wooddesign Marcello Ziliani Profiles with deliberately generous sections…. Etch Armchair. Flap Modular Loungedesign Meneghello Paolelli Flap is a collection of…. Feast Banquet Table – RectanglePure polyethylene blow moulded top, shock proof and…. Finn Metal Wood Armchairdesign Marcello Ziliani Profiles with deliberately generous sections…Enquire Now. Finn All Wood Chairdesign Marcello Ziliani Profiles with deliberately generous sections…. Eyre Dining ChairClassic dining chair with hand-woven synthetic rattan and…Enquire Now. Ethel Dining Chair. Etch ArmchairThis contemporary armchair with curved backrest and arms…. Finn Metal Wood. Feast Banquet Table – Rectangle. Finn Chair. Fawn Outdoor Bentwood StoolFinally, a range of bentwood chairs that are…"
https://mintffe.com.au/products/?product-page=15,"Flora Chair, Fluit Armchair, Fluit Bar Stool, Fluit Chair, Flynn Lounge Chair, Fondina, Fondina Bar Stool, Foundry High Bar Base, Foundry Table Base, Foundry Twin Base, Franklin Armchair, Frasca High Bar Base, Frasca Table Base, Frieda Chair, Frisbee Barstool, Frisbee Chair, Gable Outdoor Chair, Gable Outdoor Stool, Galaxy Chair, Gelesys, Genevieve, Geo Table Base, Ghibli, Ghibli Armchair","Ghibli is a seating collection that offers something…. Flynn Lounge ChairSolid timber armchair with timber slat detail to…Enquire Now. Frisbee ChairDesigner: Balutto e Associati The Frisbee chair makes of…. Frisbee BarstoolDesigner: Balutto e Associati The Frisbee barstool makes its…. Gable Outdoor Chair. Gable Outdoor Stool. Flynn Lounge ChairSolid timber armchair with timber slat detail to…. Frieda Chair. Designed by Archirivolto for ACTIU FLUIT is made…. Gable Outdoor StoolGable is a stackable outdoor stool with a…Enquire Now. Fondina Bar Stool. Flora Chair. Frasca Table Base. Fluit Bar StoolDesigned by Archirivolto for ACTIU FLUIT is made…Enquire Now. Frieda ChairThe Frieda outdoor dining chair is a bold…Enquire Now. Gelesys differs for the innovative gel technology, for the durability guaranteed…. The Foundry table base is made from cast…. Fluit Chair. Galaxy ChairGalaxy by Lincoln Brooks makes a statement with…Enquire Now. GenevieveFrench inspired timber dining chair with oval shaped…Enquire Now. Galaxy Chair. Flora ChairEnquire Now. The Foundry Twin table base is made from…. GhibliGhibli is a seating collection that offers something…Enquire Now. The Foundry bar table base is made from…. Gable is a stackable outdoor stool with a…. Frasca High Bar Base. Designer: Balutto e Associati The Frisbee chair makes of…. Foundry Twin Base. Gable is a stackable outdoor chair with a…. Solid timber armchair with timber slat detail to…. Geo Table BaseTerrazzo stone base with powdercoated iron column and…. Foundry High Bar BaseThe Foundry bar table base is made from…Enquire Now. Terrazzo stone base with powdercoated iron column and…. Foundry Twin BaseThe Foundry Twin table base is made from…. Frisbee Chair. Fluit ArmchairDesigned by Archirivolto for ACTIU FLUIT is made…Enquire Now. GelesysGelesys differs for the innovative gel technology, for the durability guaranteed…. Fluit ChairDesigned by Archirivolto for ACTIU FLUIT is made…. Gable Outdoor StoolGable is a stackable outdoor stool with a…. Foundry Table Base. Foundry Table BaseThe Foundry table base is made from cast…. Fluit ArmchairDesigned by Archirivolto for ACTIU FLUIT is made…. Gable Outdoor ChairGable is a stackable outdoor chair with a…. Frisbee ChairDesigner: Balutto e Associati The Frisbee chair makes of…Enquire Now. Ghibli ArmchairGhibli is a seating collection that offers something…. Gable Outdoor ChairGable is a stackable outdoor chair with a…Enquire Now. Frieda ChairThe Frieda outdoor dining chair is a bold…. Filter by. Ghibli Armchair. Frasca Table Basethe Frasca Table Base is an exciting addition…. Frasca High Bar BaseThe Frasca High Bar Base is an exciting…. Foundry Table BaseThe Foundry table base is made from cast…Enquire Now. Fluit Armchair. Franklin Armchair. Galaxy ChairGalaxy by Lincoln Brooks makes a statement with…. Frasca Table Basethe Frasca Table Base is an exciting addition…Enquire Now. Geo Table Base. Frisbee Barstool. the Frasca Table Base is an exciting addition…. Flynn Lounge Chair. Frisbee BarstoolDesigner: Balutto e Associati The Frisbee barstool makes its…Enquire Now. Fluit Bar StoolDesigned by Archirivolto for ACTIU FLUIT is made…. The Frasca High Bar Base is an exciting…. Foundry High Bar Base. Fluit ChairDesigned by Archirivolto for ACTIU FLUIT is made…Enquire Now. Foundry High Bar BaseThe Foundry bar table base is made from…. Frasca High Bar BaseThe Frasca High Bar Base is an exciting…Enquire Now. GelesysGelesys differs for the innovative gel technology, for the durability guaranteed…Enquire Now. Geo Table BaseTerrazzo stone base with powdercoated iron column and…Enquire Now. French inspired timber dining chair with oval shaped…. Foundry Twin BaseThe Foundry Twin table base is made from…Enquire Now. GenevieveFrench inspired timber dining chair with oval shaped…. GhibliGhibli is a seating collection that offers something…. Galaxy by Lincoln Brooks makes a statement with…. Ghibli ArmchairGhibli is a seating collection that offers something…Enquire Now. Designer: Balutto e Associati The Frisbee barstool makes its…. Fluit Bar Stool. The Frieda outdoor dining chair is a bold…"
