URL,Informative_Text,Texts
https://www.furniturecontracts.com.au/product-category/outdoor-indoor-furniture/page/3/,"Neon Setting, Neon Setting (High Bar), Paree_191, Roma table base_223, Santi Bar chair_166, Santi chair_166, Saturn Stool_217, Scarlett arm chair_269, Seagate chair_233, Season Chair_257, Selina chair_236_269, Sevella_217, Shade_269, Slinq Table Tops_191, SM Moulded Resin Table tops_223, Space_191, Stainless steel table tops (Clearance), Status_176","Scarlett arm chair_269ADD TO QUOTEMore Details. Coffee Tables – (metal frame). Seagate chair_233. Sevella_217Sevella_217 quantityADD TO QUOTEMore Details. Stainless steel table tops (Clearance)ADD TO QUOTEMore Details. Furniture Contracts Bendigo. Flip Top/Mobile. Santi chair_166. Complete TablesMetal frameTimber frame. Boardroom Tables. ADD TO QUOTE. Timber frame (with back). Saturn Stool_217ADD TO QUOTEMore Details. Santi Bar chair_166Santi Bar chair_166 quantityADD TO QUOTEMore Details. Other Service Areas. Tables & Buffet's. Chairs & Stools. TablesFlip Top/MobileFixed 4 leg BaseFolding legTrapezium. Sit/Stand adjustable height desks. Visitor Chairs (metal frame). Wicker Chairs. Coffee Tables (metal frame). All resin (with back). Chairs (Metal frame). Stainless steel table tops (Clearance). Gaming stools. Folding leg. Function FurnitureChairs (Metal frame)Dance Floor and StagingLecturnTablesFlip Top/MobileFixed 4 leg BaseFolding legTrapezium. Selina chair_236_269ADD TO QUOTEMore Details. Dance Floor and Staging. Paree_191Paree_191 quantityADD TO QUOTEMore Details. Roma table base_223Roma table base_223 quantityADD TO QUOTEMore Details. Saturn Stool_217. Your Cart. Education & School Furniture. Speciality Chairs. Outdoor/Indoor FurnitureChairs & StoolsTable BasesTable TopsWicker Chairs. Cafe Restaurant Furniture: Dining Tables and Chairs. Table Tops. Slinq Table Tops_191. Visitor chairs (timber frame). Neon Setting (High Bar). Chairs (timber frame). Metal frame. Desks, Returns & Pedestals. Furniture Contracts Warrnambool. Visitor Chairs (Timber frame). SM Moulded Resin Table tops_223. Season Chair_257. Selina chair_236_269. Dining FurnitureChairs (metal frame)Chairs (timber frame)Complete TablesMetal frameTimber frameTable topsTable BasesMetalResin. Season Chair_257ADD TO QUOTEMore Details. Chairs (metal frame). Mesh back. Cupboards, Hutches, Filing Cabinets, Tables. Lounge Suites. Tables & Buffet’s. Quick Links. Status_176ADD TO QUOTEMore Details. SM Moulded Resin Table tops_223ADD TO QUOTEMore Details. Table Bases. Metal frame (no back). Furniture Contracts Geelong. Coffee TablesCoffee Tables (metal frame)Coffee Tables (timber frame). Metal frame (with back). Commercial Outdoor Furniture. Task chairsMesh back. Timber frame (no back). Neon SettingNeon Setting quantityADD TO QUOTEMore Details. Space_191ADD TO QUOTEMore Details. Scarlett arm chair_269. Fixed 4 leg Base. Coffee Tables (timber frame). Visitor chairs (metal frame). Booth, Bench, Beam, Ottoman & Banquette seating. Desks, Reception, Pedestals, Hutches and Return’s. Neon Setting (High Bar)Neon Setting (High Bar) quantityADD TO QUOTEMore Details. Santi chair_166Santi chair_166 quantityADD TO QUOTEMore Details. All resin (no back). Education/School FurnitureChairs (metal frame)Chairs (timber frame)Desks, Reception, Pedestals, Hutches and Return’sTablesAccessoriesStoolsStorage. Table tops. Timber frame. Roma table base_223. Slinq Table Tops_191ADD TO QUOTEMore Details. Neon Setting. Chairs (Timber frame). Shade_269ADD TO QUOTEMore Details. Bedside Cupboards. Tub chairs. Seagate chair_233Seagate chair_233 quantityADD TO QUOTEMore Details. Contact Info. Desks, Reception, Pedestals, Hutches and Return's. Table BasesMetalResin. Santi Bar chair_166. Healthcare FurnitureChairs (Timber frame)Chairs (Metal frame)Speciality ChairsTables & Buffet’sBedside Cupboards"
https://www.furniturecontracts.com.au/product-category/outdoor-indoor-furniture/page/4/,"Stem_223, Sunny Arm Chair, Switch chair_236_269, Table Equalizers – Stabilize existing table bases_224, Tally Stool_097, Tauris_097_191_223, Teak Table Tops, Tosh Stool_097, U422_U507_217, Vibe_176, Vita, Wanda arm chair_223, Wren_223","Teak Table TopsADD TO QUOTEMore Details. Coffee Tables – (metal frame). Tally Stool_097. Table Equalizers – Stabilize existing table bases_224ADD TO QUOTEMore Details. Furniture Contracts Bendigo. Flip Top/Mobile. Complete TablesMetal frameTimber frame. Boardroom Tables. ADD TO QUOTE. Timber frame (with back). Other Service Areas. Tables & Buffet's. Chairs & Stools. TablesFlip Top/MobileFixed 4 leg BaseFolding legTrapezium. VitaVita quantityADD TO QUOTEMore Details. Switch chair_236_269. Sit/Stand adjustable height desks. Visitor Chairs (metal frame). Wicker Chairs. Coffee Tables (metal frame). All resin (with back). Chairs (Metal frame). Switch chair_236_269ADD TO QUOTEMore Details. Gaming stools. Folding leg. Function FurnitureChairs (Metal frame)Dance Floor and StagingLecturnTablesFlip Top/MobileFixed 4 leg BaseFolding legTrapezium. Wanda arm chair_223ADD TO QUOTEMore Details. Dance Floor and Staging. Wren_223Wren_223 quantityADD TO QUOTEMore Details. Your Cart. Education & School Furniture. Speciality Chairs. Outdoor/Indoor FurnitureChairs & StoolsTable BasesTable TopsWicker Chairs. Cafe Restaurant Furniture: Dining Tables and Chairs. Table Tops. Visitor chairs (timber frame). Chairs (timber frame). Metal frame. Desks, Returns & Pedestals. Furniture Contracts Warrnambool. U422_U507_217U422_U507_217 quantityADD TO QUOTEMore Details. Stem_223Stem_223 quantityADD TO QUOTEMore Details. Visitor Chairs (Timber frame). Dining FurnitureChairs (metal frame)Chairs (timber frame)Complete TablesMetal frameTimber frameTable topsTable BasesMetalResin. Chairs (metal frame). Mesh back. Cupboards, Hutches, Filing Cabinets, Tables. Lounge Suites. Tables & Buffet’s. Quick Links. Wanda arm chair_223. Table Bases. Vibe_176ADD TO QUOTEMore Details. Metal frame (no back). Furniture Contracts Geelong. Coffee TablesCoffee Tables (metal frame)Coffee Tables (timber frame). Metal frame (with back). Commercial Outdoor Furniture. Tauris_097_191_223Tauris_097_191_223 quantityADD TO QUOTEMore Details. Task chairsMesh back. Timber frame (no back). Fixed 4 leg Base. Coffee Tables (timber frame). Visitor chairs (metal frame). Tosh Stool_097. Booth, Bench, Beam, Ottoman & Banquette seating. Desks, Reception, Pedestals, Hutches and Return’s. Sunny Arm Chair. Table Equalizers – Stabilize existing table bases_224. All resin (no back). Education/School FurnitureChairs (metal frame)Chairs (timber frame)Desks, Reception, Pedestals, Hutches and Return’sTablesAccessoriesStoolsStorage. Table tops. Teak Table Tops. Timber frame. Tosh Stool_097Tosh Stool_097 quantityADD TO QUOTEMore Details. Chairs (Timber frame). Bedside Cupboards. Tally Stool_097Tally Stool_097 quantityADD TO QUOTEMore Details. Tub chairs. Contact Info. Sunny Arm ChairADD TO QUOTEMore Details. Desks, Reception, Pedestals, Hutches and Return's. Table BasesMetalResin. Healthcare FurnitureChairs (Timber frame)Chairs (Metal frame)Speciality ChairsTables & Buffet’sBedside Cupboards"
https://www.furniturecontracts.com.au/product-category/lounge-chairs-furniture/page/1/,"Album chair_248, Ayres Tub_212, Bariatric_211_104, Baxter_178, Bayton table_020_021, Beal_002, Becker_005, Bench seating with back_020, Block Ottomans_223, Blush Beam Seating_211, Blush_211, Bologna_097 (Cast aluminium base), Broadford, Candice arm chair_223, Carla Arm chair_037, Casterton_259, Channel_248, Char_060","Coffee Tables – (metal frame). Bench seating with back_020Bench seating with back_020 quantityADD TO QUOTEMore Details. Candice arm chair_223. Ayres Tub_212. Bayton table_020_021. Becker_005Becker_005 quantityADD TO QUOTEMore Details. Furniture Contracts Bendigo. Flip Top/Mobile. Complete TablesMetal frameTimber frame. Boardroom Tables. ADD TO QUOTE. Timber frame (with back). Block Ottomans_223. Lounge and Visitor Furniture - Chairs, Tables, and More. Other Service Areas. Carla Arm chair_037ADD TO QUOTEMore Details. Tables & Buffet's. Chairs & Stools. TablesFlip Top/MobileFixed 4 leg BaseFolding legTrapezium. Sit/Stand adjustable height desks. Visitor Chairs (metal frame). Wicker Chairs. Coffee Tables (metal frame). All resin (with back). Chairs (Metal frame). BroadfordBroadford quantityADD TO QUOTEMore Details. Gaming stools. Folding leg. Function FurnitureChairs (Metal frame)Dance Floor and StagingLecturnTablesFlip Top/MobileFixed 4 leg BaseFolding legTrapezium. Bariatric_211_104Bariatric_211_104 quantityADD TO QUOTEMore Details. Lounge/Visitor Furniture. Dance Floor and Staging. Your Cart. Education & School Furniture. Casterton_259Casterton_259 quantityADD TO QUOTEMore Details. Speciality Chairs. Outdoor/Indoor FurnitureChairs & StoolsTable BasesTable TopsWicker Chairs. Cafe Restaurant Furniture: Dining Tables and Chairs. Table Tops. Visitor chairs (timber frame). Chairs (timber frame). Metal frame. Desks, Returns & Pedestals. Furniture Contracts Warrnambool. Visitor Chairs (Timber frame). Ayres Tub_212ADD TO QUOTEMore Details. Blush_211Blush_211 quantityADD TO QUOTEMore Details. Beal_002Beal_002 quantityADD TO QUOTEMore Details. Dining FurnitureChairs (metal frame)Chairs (timber frame)Complete TablesMetal frameTimber frameTable topsTable BasesMetalResin. Chairs (metal frame). Mesh back. Block Ottomans_223Block Ottomans_223 quantityADD TO QUOTEMore Details. Cupboards, Hutches, Filing Cabinets, Tables. Candice arm chair_223ADD TO QUOTEMore Details. Lounge Suites. Tables & Buffet’s. Quick Links. Table Bases. Char_060ADD TO QUOTEMore Details. Metal frame (no back). Furniture Contracts Geelong. Coffee TablesCoffee Tables (metal frame)Coffee Tables (timber frame). Metal frame (with back). Commercial Outdoor Furniture. Task chairsMesh back. Timber frame (no back). Bologna_097 (Cast aluminium base). Bologna_097 (Cast aluminium base)Bologna_097 (Cast aluminium base) quantityADD TO QUOTEMore Details. Blush Beam Seating_211ADD TO QUOTEMore Details. Bayton table_020_021Bayton table_020_021 quantityADD TO QUOTEMore Details. Fixed 4 leg Base. Coffee Tables (timber frame). Visitor chairs (metal frame). Booth, Bench, Beam, Ottoman & Banquette seating. Desks, Reception, Pedestals, Hutches and Return’s. Baxter_178Baxter_178 quantityADD TO QUOTEMore Details. Channel_248Channel_248 quantityADD TO QUOTEMore Details. All resin (no back). Education/School FurnitureChairs (metal frame)Chairs (timber frame)Desks, Reception, Pedestals, Hutches and Return’sTablesAccessoriesStoolsStorage. Bench seating with back_020. Table tops. Album chair_248. Timber frame. Designer Lounge Chairs. Carla Arm chair_037. Blush Beam Seating_211. Album chair_248ADD TO QUOTEMore Details. Chairs (Timber frame). Bedside Cupboards. Tub chairs. Contact Info. Desks, Reception, Pedestals, Hutches and Return's. Table BasesMetalResin. Healthcare FurnitureChairs (Timber frame)Chairs (Metal frame)Speciality ChairsTables & Buffet’sBedside Cupboards"
https://www.furniturecontracts.com.au/product-category/lounge-chairs-furniture/page/2/,"Chrome dish coffee table_178, Collect Arm Chair_270, Collier Arm chair, Comfo, Converse_169, Core_207, Cove_186, Dargo Executive Tub_178, Dargo Tub_178, Daze lounge arm chair_223, Daze lounge Sofa XL_223, Ellen, Equity_016, Evans Beam Seating, Evans_016, FCB.01, FCB.03 (Single & Double sided), FCB.04","Coffee Tables – (metal frame). Furniture Contracts Bendigo. Collect Arm Chair_270. Flip Top/Mobile. Complete TablesMetal frameTimber frame. Boardroom Tables. ADD TO QUOTE. Timber frame (with back). Daze lounge Sofa XL_223ADD TO QUOTEMore Details. Evans Beam SeatingEvans Beam Seating quantityADD TO QUOTEMore Details. Lounge and Visitor Furniture - Chairs, Tables, and More. Other Service Areas. Tables & Buffet's. Chairs & Stools. TablesFlip Top/MobileFixed 4 leg BaseFolding legTrapezium. Sit/Stand adjustable height desks. Visitor Chairs (metal frame). Dargo Executive Tub_178Dargo Executive Tub_178 quantityADD TO QUOTEMore Details. Wicker Chairs. Coffee Tables (metal frame). All resin (with back). Dargo Tub_178. Chairs (Metal frame). Equity_016Equity_016 quantityADD TO QUOTEMore Details. Gaming stools. Folding leg. Function FurnitureChairs (Metal frame)Dance Floor and StagingLecturnTablesFlip Top/MobileFixed 4 leg BaseFolding legTrapezium. Collier Arm chairCollier Arm chair quantityADD TO QUOTEMore Details. Evans Beam Seating. Dance Floor and Staging. Collier Arm chair. Your Cart. Education & School Furniture. Speciality Chairs. Outdoor/Indoor FurnitureChairs & StoolsTable BasesTable TopsWicker Chairs. Cafe Restaurant Furniture: Dining Tables and Chairs. Daze lounge arm chair_223. Daze lounge arm chair_223ADD TO QUOTEMore Details. Table Tops. Visitor chairs (timber frame). Chairs (timber frame). Metal frame. Dargo Tub_178Dargo Tub_178 quantityADD TO QUOTEMore Details. Desks, Returns & Pedestals. Furniture Contracts Warrnambool. Visitor Chairs (Timber frame). Dining FurnitureChairs (metal frame)Chairs (timber frame)Complete TablesMetal frameTimber frameTable topsTable BasesMetalResin. EllenEllen quantityADD TO QUOTEMore Details. Chairs (metal frame). Mesh back. ComfoComfo quantityADD TO QUOTEMore Details. Cupboards, Hutches, Filing Cabinets, Tables. Lounge Suites. Tables & Buffet’s. Quick Links. Evans_016Evans_016 quantityADD TO QUOTEMore Details. Table Bases. Chrome dish coffee table_178. Metal frame (no back). Furniture Contracts Geelong. Coffee TablesCoffee Tables (metal frame)Coffee Tables (timber frame). Metal frame (with back). Commercial Outdoor Furniture. Task chairsMesh back. Timber frame (no back). Cove_186Cove_186 quantityADD TO QUOTEMore Details. Core_207ADD TO QUOTEMore Details. Fixed 4 leg Base. Coffee Tables (timber frame). Visitor chairs (metal frame). Booth, Bench, Beam, Ottoman & Banquette seating. Desks, Reception, Pedestals, Hutches and Return’s. Daze lounge Sofa XL_223. All resin (no back). Education/School FurnitureChairs (metal frame)Chairs (timber frame)Desks, Reception, Pedestals, Hutches and Return’sTablesAccessoriesStoolsStorage. Table tops. Timber frame. Dargo Executive Tub_178. Chrome dish coffee table_178Chrome dish coffee table_178 quantityADD TO QUOTEMore Details. Chairs (Timber frame). Bedside Cupboards. Tub chairs. Collect Arm Chair_270ADD TO QUOTEMore Details. Contact Info. Desks, Reception, Pedestals, Hutches and Return's. Converse_169ADD TO QUOTEMore Details. Table BasesMetalResin. Healthcare FurnitureChairs (Timber frame)Chairs (Metal frame)Speciality ChairsTables & Buffet’sBedside Cupboards"
https://www.furniturecontracts.com.au/product-category/lounge-chairs-furniture/page/3/,"FCB.05_020, FCB.06, Flex_046, Gail_178_081, Glass coffee table_178, Hawksbury, Heidleberg_037, Henson_extra wide_104, Heyfield_037, Hicks arm chair_236, Hobson_Coffee & Side Tables_186, Josh bench ottoman_166, Kara_178/031, Kiri Arm chair_212, Kirk_021, Lamond_176, Lawler_037, Limit chair_212","Coffee Tables – (metal frame). Kiri Arm chair_212ADD TO QUOTEMore Details. Furniture Contracts Bendigo. Flip Top/Mobile. Complete TablesMetal frameTimber frame. Boardroom Tables. ADD TO QUOTE. Timber frame (with back). Lounge and Visitor Furniture - Chairs, Tables, and More. Heidleberg_037Heidleberg_037 quantityADD TO QUOTEMore Details. Kirk_021Kirk_021 quantityADD TO QUOTEMore Details. Other Service Areas. Tables & Buffet's. Chairs & Stools. TablesFlip Top/MobileFixed 4 leg BaseFolding legTrapezium. Kiri Arm chair_212. Josh bench ottoman_166Josh bench ottoman_166 quantityADD TO QUOTEMore Details. Sit/Stand adjustable height desks. Visitor Chairs (metal frame). Wicker Chairs. Hobson_Coffee & Side Tables_186Hobson_Coffee & Side Tables_186 quantityADD TO QUOTEMore Details. Coffee Tables (metal frame). All resin (with back). Chairs (Metal frame). Gaming stools. Hobson_Coffee & Side Tables_186. Folding leg. Function FurnitureChairs (Metal frame)Dance Floor and StagingLecturnTablesFlip Top/MobileFixed 4 leg BaseFolding legTrapezium. Dance Floor and Staging. Flex_046Flex_046 quantityADD TO QUOTEMore Details. Limit chair_212ADD TO QUOTEMore Details. Your Cart. Education & School Furniture. Speciality Chairs. Outdoor/Indoor FurnitureChairs & StoolsTable BasesTable TopsWicker Chairs. Cafe Restaurant Furniture: Dining Tables and Chairs. Table Tops. Visitor chairs (timber frame). Chairs (timber frame). Metal frame. Desks, Returns & Pedestals. Furniture Contracts Warrnambool. Heyfield_037Heyfield_037 quantityADD TO QUOTEMore Details. Visitor Chairs (Timber frame). Dining FurnitureChairs (metal frame)Chairs (timber frame)Complete TablesMetal frameTimber frameTable topsTable BasesMetalResin. Chairs (metal frame). Mesh back. Hicks arm chair_236. Cupboards, Hutches, Filing Cabinets, Tables. Josh bench ottoman_166. Lounge Suites. Tables & Buffet’s. Quick Links. Table Bases. Metal frame (no back). Hicks arm chair_236ADD TO QUOTEMore Details. Henson_extra wide_104. Coffee TablesCoffee Tables (metal frame)Coffee Tables (timber frame). Metal frame (with back). Furniture Contracts Geelong. Commercial Outdoor Furniture. Lawler_037Lawler_037 quantityADD TO QUOTEMore Details. Task chairsMesh back. Timber frame (no back). Limit chair_212. Fixed 4 leg Base. Coffee Tables (timber frame). Visitor chairs (metal frame). Booth, Bench, Beam, Ottoman & Banquette seating. Desks, Reception, Pedestals, Hutches and Return’s. Glass coffee table_178Glass coffee table_178 quantityADD TO QUOTEMore Details. Glass coffee table_178. Henson_extra wide_104Henson_extra wide_104 quantityADD TO QUOTEMore Details. All resin (no back). Kara_178/031ADD TO QUOTEMore Details. Education/School FurnitureChairs (metal frame)Chairs (timber frame)Desks, Reception, Pedestals, Hutches and Return’sTablesAccessoriesStoolsStorage. Table tops. Gail_178_081ADD TO QUOTEMore Details. Timber frame. Lamond_176ADD TO QUOTEMore Details. Chairs (Timber frame). Bedside Cupboards. Tub chairs. Contact Info. Desks, Reception, Pedestals, Hutches and Return's. HawksburyHawksbury quantityADD TO QUOTEMore Details. Table BasesMetalResin. Healthcare FurnitureChairs (Timber frame)Chairs (Metal frame)Speciality ChairsTables & Buffet’sBedside Cupboards"
https://www.furniturecontracts.com.au/product-category/lounge-chairs-furniture/page/4/,"Lindal_002, Links, Logic Arm Chair_236, Manuela_005_037, Martin Arm chair_037, Meagan_037, Mig_031, Niki_088, Novo arm chair_037, Partner_Heavy duty_104, Point_248, Prize Lounge_178, Proform Beam_080, Ramada_037, Rebwik, Reese_178, Relax_176, Rennick","Coffee Tables – (metal frame). Furniture Contracts Bendigo. Flip Top/Mobile. Prize Lounge_178. Manuela_005_037Manuela_005_037 quantityADD TO QUOTEMore Details. Complete TablesMetal frameTimber frame. Boardroom Tables. ADD TO QUOTE. Timber frame (with back). Lounge and Visitor Furniture - Chairs, Tables, and More. Novo arm chair_037. Other Service Areas. Tables & Buffet's. Chairs & Stools. TablesFlip Top/MobileFixed 4 leg BaseFolding legTrapezium. Novo arm chair_037Novo arm chair_037 quantityADD TO QUOTEMore Details. Logic Arm Chair_236. Sit/Stand adjustable height desks. Visitor Chairs (metal frame). Wicker Chairs. Coffee Tables (metal frame). All resin (with back). Chairs (Metal frame). Partner_Heavy duty_104. Reese_178Reese_178 quantityADD TO QUOTEMore Details. Gaming stools. Proform Beam_080Proform Beam_080 quantityADD TO QUOTEMore Details. Niki_088ADD TO QUOTEMore Details. Folding leg. Function FurnitureChairs (Metal frame)Dance Floor and StagingLecturnTablesFlip Top/MobileFixed 4 leg BaseFolding legTrapezium. Dance Floor and Staging. RebwikADD TO QUOTEMore Details. Your Cart. Education & School Furniture. Martin Arm chair_037. Speciality Chairs. Outdoor/Indoor FurnitureChairs & StoolsTable BasesTable TopsWicker Chairs. Cafe Restaurant Furniture: Dining Tables and Chairs. Table Tops. Visitor chairs (timber frame). Proform Beam_080. Ramada_037Ramada_037 quantityADD TO QUOTEMore Details. Chairs (timber frame). Lindal_002Lindal_002 quantityADD TO QUOTEMore Details. RennickRennick quantityADD TO QUOTEMore Details. Metal frame. Desks, Returns & Pedestals. Furniture Contracts Warrnambool. Visitor Chairs (Timber frame). Dining FurnitureChairs (metal frame)Chairs (timber frame)Complete TablesMetal frameTimber frameTable topsTable BasesMetalResin. Chairs (metal frame). Mesh back. Partner_Heavy duty_104Partner_Heavy duty_104 quantityADD TO QUOTEMore Details. Cupboards, Hutches, Filing Cabinets, Tables. Lounge Suites. Prize Lounge_178ADD TO QUOTEMore Details. Point_248Point_248 quantityADD TO QUOTEMore Details. Tables & Buffet’s. Meagan_037Meagan_037 quantityADD TO QUOTEMore Details. Quick Links. Table Bases. Metal frame (no back). Furniture Contracts Geelong. Coffee TablesCoffee Tables (metal frame)Coffee Tables (timber frame). Metal frame (with back). Martin Arm chair_037Martin Arm chair_037 quantityADD TO QUOTEMore Details. Commercial Outdoor Furniture. Task chairsMesh back. Timber frame (no back). Relax_176Relax_176 quantityADD TO QUOTEMore Details. LinksLinks quantityADD TO QUOTEMore Details. Mig_031Mig_031 quantityADD TO QUOTEMore Details. Fixed 4 leg Base. Coffee Tables (timber frame). Visitor chairs (metal frame). Booth, Bench, Beam, Ottoman & Banquette seating. Desks, Reception, Pedestals, Hutches and Return’s. All resin (no back). Education/School FurnitureChairs (metal frame)Chairs (timber frame)Desks, Reception, Pedestals, Hutches and Return’sTablesAccessoriesStoolsStorage. Table tops. Timber frame. Chairs (Timber frame). Bedside Cupboards. Tub chairs. Contact Info. Logic Arm Chair_236ADD TO QUOTEMore Details. Desks, Reception, Pedestals, Hutches and Return's. Table BasesMetalResin. Healthcare FurnitureChairs (Timber frame)Chairs (Metal frame)Speciality ChairsTables & Buffet’sBedside Cupboards"
https://www.furniturecontracts.com.au/product-category/lounge-chairs-furniture/page/5/,"Roger_banquette_166, Rook Beam Seating, Roxy, Rueben chair_248, Scat_211, Scroll Arm & Side chair_236, Seaton Tub_259, Select coffee table_046, Shift_211, SM Moulded Resin Table tops_223, Southern, Spark_banquette_166, Star bench ottoman_166, Story arm chair_005, Strata_002, Summer_248 (New), Swatch coffee table_081, Switch chair_236_269","Coffee Tables – (metal frame). Rueben chair_248. Spark_banquette_166Spark_banquette_166 quantityADD TO QUOTEMore Details. Furniture Contracts Bendigo. Rook Beam Seating. Flip Top/Mobile. RoxyRoxy quantityADD TO QUOTEMore Details. Complete TablesMetal frameTimber frame. Boardroom Tables. ADD TO QUOTE. Timber frame (with back). Lounge and Visitor Furniture - Chairs, Tables, and More. Other Service Areas. Star bench ottoman_166. Tables & Buffet's. Chairs & Stools. TablesFlip Top/MobileFixed 4 leg BaseFolding legTrapezium. Scroll Arm & Side chair_236Scroll Arm & Side chair_236 quantityADD TO QUOTEMore Details. Switch chair_236_269. Sit/Stand adjustable height desks. Visitor Chairs (metal frame). Summer_248 (New)ADD TO QUOTEMore Details. Wicker Chairs. Coffee Tables (metal frame). All resin (with back). Chairs (Metal frame). Healthcare FurnitureChairs (Timber frame)Chairs (Metal frame)Speciality ChairsTables & Buffet’sBedside Cupboards. Rueben chair_248ADD TO QUOTEMore Details. Switch chair_236_269ADD TO QUOTEMore Details. Gaming stools. Strata_002Strata_002 quantityADD TO QUOTEMore Details. Folding leg. Function FurnitureChairs (Metal frame)Dance Floor and StagingLecturnTablesFlip Top/MobileFixed 4 leg BaseFolding legTrapezium. Seaton Tub_259Seaton Tub_259 quantityADD TO QUOTEMore Details. Dance Floor and Staging. Story arm chair_005. Your Cart. Education & School Furniture. Speciality Chairs. Outdoor/Indoor FurnitureChairs & StoolsTable BasesTable TopsWicker Chairs. Cafe Restaurant Furniture: Dining Tables and Chairs. Table Tops. Visitor chairs (timber frame). Chairs (timber frame). Metal frame. Rook Beam SeatingRook Beam Seating quantityADD TO QUOTEMore Details. Desks, Returns & Pedestals. Scat_211Scat_211 quantityADD TO QUOTEMore Details. Furniture Contracts Warrnambool. Visitor Chairs (Timber frame). SM Moulded Resin Table tops_223. Dining FurnitureChairs (metal frame)Chairs (timber frame)Complete TablesMetal frameTimber frameTable topsTable BasesMetalResin. Chairs (metal frame). Mesh back. Cupboards, Hutches, Filing Cabinets, Tables. Lounge Suites. SouthernSouthern quantityADD TO QUOTEMore Details. Tables & Buffet’s. Scroll Arm & Side chair_236. Quick Links. SM Moulded Resin Table tops_223ADD TO QUOTEMore Details. Summer_248 (New). Table Bases. Swatch coffee table_081. Metal frame (no back). Furniture Contracts Geelong. Coffee TablesCoffee Tables (metal frame)Coffee Tables (timber frame). Metal frame (with back). Commercial Outdoor Furniture. Task chairsMesh back. Timber frame (no back). Story arm chair_005Story arm chair_005 quantityADD TO QUOTEMore Details. Select coffee table_046Select coffee table_046 quantityADD TO QUOTEMore Details. Fixed 4 leg Base. Coffee Tables (timber frame). Visitor chairs (metal frame). Booth, Bench, Beam, Ottoman & Banquette seating. Desks, Reception, Pedestals, Hutches and Return’s. Shift_211Shift_211 quantityADD TO QUOTEMore Details. Swatch coffee table_081Swatch coffee table_081 quantityADD TO QUOTEMore Details. Select coffee table_046. All resin (no back). Education/School FurnitureChairs (metal frame)Chairs (timber frame)Desks, Reception, Pedestals, Hutches and Return’sTablesAccessoriesStoolsStorage. Table tops. Timber frame. Roger_banquette_166Roger_banquette_166 quantityADD TO QUOTEMore Details. Seaton Tub_259. Chairs (Timber frame). Bedside Cupboards. Tub chairs. Contact Info. Desks, Reception, Pedestals, Hutches and Return's. Table BasesMetalResin. Star bench ottoman_166Star bench ottoman_166 quantityADD TO QUOTEMore Details"
