URL,Informative_Text,Texts
https://mollanbros.co.uk/tv-units,"Lazzaro TV Cabinet, Salisbury Corner TV Unit, Salisbury Corner TV Unit with Baskets, Salisbury Extra Large Low Line TV Unit, Salisbury Extra Large TV Unit, Salisbury Large Low Line TV Unit, Salisbury Large TV Unit, Salisbury TV Unit, Stow Natural Oak Corner TV Unit, Stow Natural Oak Large TV Unit",Gloss bedside lockers. Salisbury Extra Large Low Line TV Unit. Leather Accent Chairs. Sintered Stone Tables. Mirrored Bedside Lockers. Salisbury Corner TV Unit with Baskets. Mirrored Dressing Tables. Chest of Drawers. Recently viewed products. Kids Beds & Bunks. Stow Natural Oak Large TV Unit. 2 Seater Sofa. Salisbury Large TV Unit. Marble Effect Tables. Wooden bedside lockers. Mirrored chest of Drawers. 3 Seater Sofa. Gloss dressing tables. Salisbury Large Low Line TV Unit. Compare products list. Wooden Dressing Tables. Gloss Chest of Drawers. Stow Natural Oak Corner TV Unit. GridListFilters51020per pagePositionName: A to ZName: Z to APrice: Low to HighPrice: High to LowCreated on. Lift & Rise Chairs. Shipping & returns. Salisbury Corner TV Unit. Nest of Tables. Add to cart. Tempered Glass Tables. PositionName: A to ZName: Z to APrice: Low to HighPrice: High to LowCreated on. Wooden Chest of Drawers. Salisbury Extra Large TV Unit. Lazzaro TV Cabinet. 4 Seater Sofa. Dressing tables stools. TV Units. Salisbury TV Unit
https://mollanbros.co.uk/mirrored-stool,Jessica Bedroom Stool,Leather Accent Chairs. Sintered Stone Tables. Mirrored Bedside Lockers. Mirrored Dressing Tables. Mirrored Stool. Chest of Drawers. Recently viewed products. Kids Beds & Bunks. 2 Seater Sofa. Marble Effect Tables. Wooden bedside lockers. Mirrored chest of Drawers. 3 Seater Sofa. Gloss dressing tables. Wooden Dressing Tables. Compare products list. Gloss Chest of Drawers. GridListFilters369per pagePositionName: A to ZName: Z to APrice: Low to HighPrice: High to LowCreated on. Jessica Bedroom Stool. Lift & Rise Chairs. Shipping & returns. Nest of Tables. Add to cart. Tempered Glass Tables. PositionName: A to ZName: Z to APrice: Low to HighPrice: High to LowCreated on. Wooden Chest of Drawers. 4 Seater Sofa. Dressing tables stools. Gloss bedside lockers
https://mollanbros.co.uk/wooden-bedframes,"Salisbury 3ft Low End Bed, Salisbury Panelled Bed, Salisbury Slatted Bed, Stow Painted 4ft6 Slatted Bedframe (White), Stow Painted 5ft Slatted Bedframe (White), Troscan Deluxe Slatted Bedframe, Troscan Havana Panel-Style Headboard, Amelia 4ft6 Panelled Bedframe (Cream), Amelia 4ft6 Panelled Bedframe (Grey), Amelia 5ft Panelled Bedframe (Cream)",Leather Accent Chairs. Sintered Stone Tables. Mirrored Bedside Lockers. Stow Painted 4ft6 Slatted Bedframe (White). Wooden bedframes. Mirrored Dressing Tables. Chest of Drawers. Recently viewed products. Kids Beds & Bunks. 2 Seater Sofa. Amelia 5ft Panelled Bedframe (Cream). Salisbury Panelled Bed. Amelia 4ft6 Panelled Bedframe (Cream). Wooden bedside lockers. Marble Effect Tables. Mirrored chest of Drawers. 3 Seater Sofa. Gloss dressing tables. Wooden Dressing Tables. Compare products list. Troscan Havana Panel-Style Headboard. Gloss Chest of Drawers. Amelia 4ft6 Panelled Bedframe (Grey). GridListFilters51020per pagePositionName: A to ZName: Z to APrice: Low to HighPrice: High to LowCreated on. Lift & Rise Chairs. Shipping & returns. Salisbury 3ft Low End Bed. Nest of Tables. Add to cart. Tempered Glass Tables. PositionName: A to ZName: Z to APrice: Low to HighPrice: High to LowCreated on. Wooden Chest of Drawers. 4 Seater Sofa. Dressing tables stools. Stow Painted 5ft Slatted Bedframe (White). Salisbury Slatted Bed. Troscan Deluxe Slatted Bedframe. Gloss bedside lockers
https://mollanbros.co.uk/wooden-stools,"Mabel Stool (Taupe), Mabel Stool (White), Troscan Stool, Riviera Stool, Doune Stool, Sorrento Stool",Sorrento Stool. Leather Accent Chairs. Sintered Stone Tables. Mirrored Bedside Lockers. Riviera Stool. Mirrored Dressing Tables. Chest of Drawers. Recently viewed products. Kids Beds & Bunks. 2 Seater Sofa. Marble Effect Tables. Wooden bedside lockers. Wooden Stools. Mirrored chest of Drawers. 3 Seater Sofa. Gloss dressing tables. Wooden Dressing Tables. Compare products list. Gloss Chest of Drawers. GridListFilters369per pagePositionName: A to ZName: Z to APrice: Low to HighPrice: High to LowCreated on. Lift & Rise Chairs. Shipping & returns. Nest of Tables. Add to cart. Troscan Stool. Tempered Glass Tables. PositionName: A to ZName: Z to APrice: Low to HighPrice: High to LowCreated on. Wooden Chest of Drawers. Mabel Stool (White). Doune Stool. 4 Seater Sofa. Dressing tables stools. Mabel Stool (Taupe). Gloss bedside lockers
https://mollanbros.co.uk/fabric2,"Blenheim 3 Seater Suite, Duke 3 Seater, Paris 3 Seater by Lebus, Trent 3 Seater, Artemis 3 Seater, Fairmont 3 Seater, Memphis 3 Seater, Savannah 3 Seater, Lowry 3 Seater, Casey 3 Seater",Artemis 3 Seater. Leather Accent Chairs. Sintered Stone Tables. Mirrored Bedside Lockers. Mirrored Dressing Tables. Chest of Drawers. Recently viewed products. Kids Beds & Bunks. Fairmont 3 Seater. 2 Seater Sofa. Marble Effect Tables. Trent 3 Seater. Wooden bedside lockers. Paris 3 Seater by Lebus. 3 Seater Sofa. Mirrored chest of Drawers. Gloss dressing tables. Wooden Dressing Tables. Compare products list. Gloss Chest of Drawers. Lowry 3 Seater. Casey 3 Seater. GridListFilters51020per pagePositionName: A to ZName: Z to APrice: Low to HighPrice: High to LowCreated on. Lift & Rise Chairs. Shipping & returns. Blenheim 3 Seater Suite. Savannah 3 Seater. Nest of Tables. Add to cart. Tempered Glass Tables. PositionName: A to ZName: Z to APrice: Low to HighPrice: High to LowCreated on. Wooden Chest of Drawers. Duke 3 Seater. 4 Seater Sofa. Dressing tables stools. Memphis 3 Seater. Gloss bedside lockers
https://mollanbros.co.uk/respa,"Respa Fantasia Mattress, Respa Pocket 1600 Mattress, Respa Pocket 1200 Mattress, Respa Pocket 1400 Pillowtop Mattress, Respa Gel Pocket Elite Mattress, Gel Horizon Mattress, Pocket Pillowtop 2000 Mattress, Diamond 3000 Mattress, Respa Rhapsody 2000 Mattress, Respa Hibernate 3000 Mattress",Respa Hibernate 3000 Mattress. Leather Accent Chairs. Sintered Stone Tables. Mirrored Bedside Lockers. Mirrored Dressing Tables. Pocket Pillowtop 2000 Mattress. Chest of Drawers. Recently viewed products. Kids Beds & Bunks. Respa Gel Pocket Elite Mattress. Diamond 3000 Mattress. 2 Seater Sofa. Marble Effect Tables. Wooden bedside lockers. Mirrored chest of Drawers. 3 Seater Sofa. Gloss dressing tables. Wooden Dressing Tables. Compare products list. Respa Pocket 1400 Pillowtop Mattress. Gel Horizon Mattress. Gloss Chest of Drawers. GridListFilters51020per pagePositionName: A to ZName: Z to APrice: Low to HighPrice: High to LowCreated on. Respa Rhapsody 2000 Mattress. Lift & Rise Chairs. Shipping & returns. Nest of Tables. Add to cart. Tempered Glass Tables. PositionName: A to ZName: Z to APrice: Low to HighPrice: High to LowCreated on. Wooden Chest of Drawers. Respa Pocket 1600 Mattress. 4 Seater Sofa. Dressing tables stools. Respa Fantasia Mattress. Respa Pocket 1200 Mattress. Gloss bedside lockers
https://mollanbros.co.uk/wall-art,"1948 Jag, After the Race Framed Art, Balloons over Mountains Wall Art, Boat on the River, Carrick-a-Rede Bridge, City Peace Bridge Colour, Colourful Butterfly Tree Wall Art, Colourful Love Tree Wall Art, Dark Hedges B&W, Dark Hedges Colour",Colourful Love Tree Wall Art. City Peace Bridge Colour. Leather Accent Chairs. Sintered Stone Tables. Mirrored Bedside Lockers. Mirrored Dressing Tables. Chest of Drawers. Recently viewed products. Kids Beds & Bunks. 2 Seater Sofa. Dark Hedges Colour. Dark Hedges B&W. 1948 Jag. Wooden bedside lockers. Marble Effect Tables. Mirrored chest of Drawers. 3 Seater Sofa. Gloss dressing tables. Wooden Dressing Tables. Compare products list. Gloss Chest of Drawers. Wall Art. Boat on the River. After the Race Framed Art. GridListFilters51020per pagePositionName: A to ZName: Z to APrice: Low to HighPrice: High to LowCreated on. Lift & Rise Chairs. Shipping & returns. Nest of Tables. Add to cart. Carrick-a-Rede Bridge. PositionName: A to ZName: Z to APrice: Low to HighPrice: High to LowCreated on. Wooden Chest of Drawers. Tempered Glass Tables. Colourful Butterfly Tree Wall Art. 4 Seater Sofa. Dressing tables stools. Gloss bedside lockers. Balloons over Mountains Wall Art
https://mollanbros.co.uk/marble-tables,"Arianna Dining Table, Arturo Dining Table, Arturo Round Dining Table, Carra Dining Table Round - Bone White 1300, Florence 1.2m Rectangular Dining Table, Florence 1.2m Round Dining Table",Marble Tables. Leather Accent Chairs. Sintered Stone Tables. Mirrored Bedside Lockers. Carra Dining Table Round - Bone White 1300. Mirrored Dressing Tables. Chest of Drawers. Recently viewed products. Kids Beds & Bunks. 2 Seater Sofa. Arturo Dining Table. Marble Effect Tables. Wooden bedside lockers. Mirrored chest of Drawers. 3 Seater Sofa. Gloss dressing tables. Wooden Dressing Tables. Compare products list. Gloss Chest of Drawers. GridListFilters369per pagePositionName: A to ZName: Z to APrice: Low to HighPrice: High to LowCreated on. Lift & Rise Chairs. Shipping & returns. Nest of Tables. Add to cart. Arianna Dining Table. Tempered Glass Tables. PositionName: A to ZName: Z to APrice: Low to HighPrice: High to LowCreated on. Wooden Chest of Drawers. 4 Seater Sofa. Dressing tables stools. Arturo Round Dining Table. Gloss bedside lockers
https://mollanbros.co.uk/fabric-chairs,"Lions Head Dining Chair, Malmo Dining Chair, Sutton Dining Chair, Valent Dining Chair - Blue, Valent Dining Chair - Dark Grey, Valent Dining Chair - Light Grey",Leather Accent Chairs. Sintered Stone Tables. Valent Dining Chair - Light Grey. Mirrored Bedside Lockers. Mirrored Dressing Tables. Chest of Drawers. Recently viewed products. Kids Beds & Bunks. Fabric Chairs. 2 Seater Sofa. Marble Effect Tables. Wooden bedside lockers. Mirrored chest of Drawers. 3 Seater Sofa. Gloss dressing tables. Wooden Dressing Tables. Compare products list. Lions Head Dining Chair. Gloss Chest of Drawers. GridListFilters369per pagePositionName: A to ZName: Z to APrice: Low to HighPrice: High to LowCreated on. Lift & Rise Chairs. Shipping & returns. Nest of Tables. Valent Dining Chair - Blue. Add to cart. Tempered Glass Tables. PositionName: A to ZName: Z to APrice: Low to HighPrice: High to LowCreated on. Wooden Chest of Drawers. 4 Seater Sofa. Dressing tables stools. Valent Dining Chair - Dark Grey. Sutton Dining Chair. Malmo Dining Chair. Gloss bedside lockers
https://mollanbros.co.uk/fabric10,"Lawton by Lazboy, Tamla by Lazboy, Baxter by Lazboy, Herbert Electric Reclining Suite, Casey Suite, Leroy Suite, Phoenix Electric Reclining Suite, Reese Suite, Marseille 3 Seater, marseille 2 Seater",Leather Accent Chairs. Sintered Stone Tables. Mirrored Bedside Lockers. marseille 2 Seater. Mirrored Dressing Tables. Chest of Drawers. Recently viewed products. Kids Beds & Bunks. 2 Seater Sofa. Phoenix Electric Reclining Suite. Baxter by Lazboy. Marble Effect Tables. Wooden bedside lockers. Mirrored chest of Drawers. 3 Seater Sofa. Gloss dressing tables. Leroy Suite. Wooden Dressing Tables. Compare products list. Gloss Chest of Drawers. Tamla by Lazboy. Marseille 3 Seater. Casey Suite. GridListFilters51020per pagePositionName: A to ZName: Z to APrice: Low to HighPrice: High to LowCreated on. Lift & Rise Chairs. Shipping & returns. Herbert Electric Reclining Suite. Nest of Tables. Add to cart. Tempered Glass Tables. PositionName: A to ZName: Z to APrice: Low to HighPrice: High to LowCreated on. Wooden Chest of Drawers. 4 Seater Sofa. Dressing tables stools. Lawton by Lazboy. Reese Suite. Gloss bedside lockers
https://mollanbros.co.uk/lazboy,"Baxter by Lazboy, Jefferson by Lazboy, Trent by Lazboy, Winchester by Lazboy, Sloane By Lazboy, Tamla by Lazboy, Lawton by Lazboy, Augustine by Lazboy",Leather Accent Chairs. Sintered Stone Tables. Mirrored Bedside Lockers. Mirrored Dressing Tables. Chest of Drawers. Trent by Lazboy. Kids Beds & Bunks. Recently viewed products. 2 Seater Sofa. Baxter by Lazboy. Winchester by Lazboy. Marble Effect Tables. Wooden bedside lockers. Mirrored chest of Drawers. 3 Seater Sofa. Gloss dressing tables. Wooden Dressing Tables. Compare products list. Gloss Chest of Drawers. Sloane By Lazboy. Tamla by Lazboy. GridListFilters51020per pagePositionName: A to ZName: Z to APrice: Low to HighPrice: High to LowCreated on. Lift & Rise Chairs. Shipping & returns. Nest of Tables. Add to cart. Tempered Glass Tables. PositionName: A to ZName: Z to APrice: Low to HighPrice: High to LowCreated on. Wooden Chest of Drawers. 4 Seater Sofa. Dressing tables stools. Jefferson by Lazboy. Lawton by Lazboy. Augustine by Lazboy. Gloss bedside lockers
https://mollanbros.co.uk/chloes-mattress,Chloe Mattress,Leather Accent Chairs. Sintered Stone Tables. Mirrored Bedside Lockers. Mirrored Dressing Tables. Chest of Drawers. Recently viewed products. Kids Beds & Bunks. 2 Seater Sofa. Marble Effect Tables. Wooden bedside lockers. Mirrored chest of Drawers. 3 Seater Sofa. Gloss dressing tables. Wooden Dressing Tables. Compare products list. Gloss Chest of Drawers. GridListFilters51020per pagePositionName: A to ZName: Z to APrice: Low to HighPrice: High to LowCreated on. Lift & Rise Chairs. Shipping & returns. Nest of Tables. Add to cart. Tempered Glass Tables. PositionName: A to ZName: Z to APrice: Low to HighPrice: High to LowCreated on. Wooden Chest of Drawers. 4 Seater Sofa. Dressing tables stools. Chloe Mattress. Gloss bedside lockers
https://mollanbros.co.uk/bedsets,"Chloe Divan Bed Deal, Deluxe Set Deal, Regal Divan Set, Ultima Ottoman Bed Package Deal",Deluxe Set Deal. Leather Accent Chairs. Sintered Stone Tables. Mirrored Bedside Lockers. Mirrored Dressing Tables. Chest of Drawers. Recently viewed products. Kids Beds & Bunks. Chloe Divan Bed Deal. 2 Seater Sofa. Regal Divan Set. Marble Effect Tables. Wooden bedside lockers. Mirrored chest of Drawers. 3 Seater Sofa. Gloss dressing tables. Wooden Dressing Tables. Compare products list. Gloss Chest of Drawers. GridListFilters51020per pagePositionName: A to ZName: Z to APrice: Low to HighPrice: High to LowCreated on. Lift & Rise Chairs. Shipping & returns. Nest of Tables. Add to cart. Tempered Glass Tables. PositionName: A to ZName: Z to APrice: Low to HighPrice: High to LowCreated on. Wooden Chest of Drawers. 4 Seater Sofa. Dressing tables stools. Ultima Ottoman Bed Package Deal. Gloss bedside lockers
https://mollanbros.co.uk/fabric8,"Penrith 3 Seater, Penrith 2 Seater, Penrith Armchair, Leroy 3 Seater Sofa, Leroy 2 Seater Sofa, Leroy Chair, Baxter by Lazboy 2 Seater (Power Reclining), Baxter by Lazboy 2 Seater (Manual Reclining), Herbert Chair, Herbert 3 Seater",Leather Accent Chairs. Sintered Stone Tables. Mirrored Bedside Lockers. Leroy 2 Seater Sofa. Mirrored Dressing Tables. Baxter by Lazboy 2 Seater (Manual Reclining). Baxter by Lazboy 2 Seater (Power Reclining). Chest of Drawers. Penrith 2 Seater. Kids Beds & Bunks. Recently viewed products. 2 Seater Sofa. Leroy 3 Seater Sofa. Marble Effect Tables. Wooden bedside lockers. Mirrored chest of Drawers. 3 Seater Sofa. Gloss dressing tables. Herbert Chair. Wooden Dressing Tables. Compare products list. Penrith 3 Seater. Herbert 3 Seater. Gloss Chest of Drawers. Penrith Armchair. Leroy Chair. GridListFilters51020per pagePositionName: A to ZName: Z to APrice: Low to HighPrice: High to LowCreated on. Lift & Rise Chairs. Shipping & returns. Nest of Tables. Add to cart. Tempered Glass Tables. PositionName: A to ZName: Z to APrice: Low to HighPrice: High to LowCreated on. Wooden Chest of Drawers. 4 Seater Sofa. Dressing tables stools. Gloss bedside lockers
https://mollanbros.co.uk/gloss-wardrobes,"Miami 2 Door All Hanging Robe, Miami 3 Door 2 Drawer Robe, Miami 3 Door All Hanging Robe, Kristel 4 door Robe with Lights",Leather Accent Chairs. Sintered Stone Tables. Mirrored Bedside Lockers. Gloss wardrobes. Mirrored Dressing Tables. Chest of Drawers. Recently viewed products. Kids Beds & Bunks. 2 Seater Sofa. Miami 3 Door 2 Drawer Robe. Miami 3 Door All Hanging Robe. Marble Effect Tables. Wooden bedside lockers. Mirrored chest of Drawers. 3 Seater Sofa. Gloss dressing tables. Wooden Dressing Tables. Compare products list. Gloss Chest of Drawers. Kristel 4 door Robe with Lights. Miami 2 Door All Hanging Robe. GridListFilters51020per pagePositionName: A to ZName: Z to APrice: Low to HighPrice: High to LowCreated on. Lift & Rise Chairs. Shipping & returns. Nest of Tables. Add to cart. Tempered Glass Tables. PositionName: A to ZName: Z to APrice: Low to HighPrice: High to LowCreated on. Wooden Chest of Drawers. 4 Seater Sofa. Dressing tables stools. Gloss bedside lockers
https://mollanbros.co.uk/sintered-stone-tables,"Quinn 120cm Rectangular Dining Table, Quinn 160cm Rectangular Dining Table, Quinn 80cm Round Dining Table, Lunar 120cm Round Table, Lunar 140cm Ext Table, Lunar 160cm Ext Table",Lunar 140cm Ext Table. Leather Accent Chairs. Sintered Stone Tables. Mirrored Bedside Lockers. Quinn 80cm Round Dining Table. Mirrored Dressing Tables. Chest of Drawers. Recently viewed products. Kids Beds & Bunks. 2 Seater Sofa. Lunar 120cm Round Table. Marble Effect Tables. Wooden bedside lockers. Mirrored chest of Drawers. 3 Seater Sofa. Gloss dressing tables. Wooden Dressing Tables. Compare products list. Gloss Chest of Drawers. Quinn 160cm Rectangular Dining Table. GridListFilters369per pagePositionName: A to ZName: Z to APrice: Low to HighPrice: High to LowCreated on. Quinn 120cm Rectangular Dining Table. Lift & Rise Chairs. Shipping & returns. Lunar 160cm Ext Table. Nest of Tables. Add to cart. Tempered Glass Tables. PositionName: A to ZName: Z to APrice: Low to HighPrice: High to LowCreated on. Wooden Chest of Drawers. 4 Seater Sofa. Dressing tables stools. Gloss bedside lockers
https://mollanbros.co.uk/kitchen-islands,Salisbury Kitchen Island,Leather Accent Chairs. Sintered Stone Tables. Mirrored Bedside Lockers. Mirrored Dressing Tables. Chest of Drawers. Recently viewed products. Kids Beds & Bunks. Salisbury Kitchen Island. 2 Seater Sofa. Kitchen Islands. Marble Effect Tables. Wooden bedside lockers. Mirrored chest of Drawers. 3 Seater Sofa. Gloss dressing tables. Wooden Dressing Tables. Compare products list. Gloss Chest of Drawers. GridListFilters51020per pagePositionName: A to ZName: Z to APrice: Low to HighPrice: High to LowCreated on. Lift & Rise Chairs. Shipping & returns. Nest of Tables. Add to cart. Tempered Glass Tables. PositionName: A to ZName: Z to APrice: Low to HighPrice: High to LowCreated on. Wooden Chest of Drawers. 4 Seater Sofa. Dressing tables stools. Gloss bedside lockers
https://mollanbros.co.uk/lazboyr,"Augustine Recliner Chair, Augustine Rocker Recliner Chair, Winchester Power Rocker Recliner Chair, Winchester Recliner Chair, Jefferson by Lazboy Chair (Power Reclining), Harvey Rocker Recliner Chair by Lazboy, Claudia Chair, Egan Chair",Winchester Power Rocker Recliner Chair. Leather Accent Chairs. Sintered Stone Tables. Mirrored Bedside Lockers. Mirrored Dressing Tables. Chest of Drawers. Recently viewed products. Kids Beds & Bunks. 2 Seater Sofa. Winchester Recliner Chair. Augustine Rocker Recliner Chair. Augustine Recliner Chair. Wooden bedside lockers. Marble Effect Tables. Mirrored chest of Drawers. 3 Seater Sofa. Gloss dressing tables. Claudia Chair. Wooden Dressing Tables. Compare products list. Gloss Chest of Drawers. GridListFilters51020per pagePositionName: A to ZName: Z to APrice: Low to HighPrice: High to LowCreated on. Lift & Rise Chairs. Shipping & returns. Harvey Rocker Recliner Chair by Lazboy. Nest of Tables. Add to cart. Tempered Glass Tables. PositionName: A to ZName: Z to APrice: Low to HighPrice: High to LowCreated on. Wooden Chest of Drawers. Jefferson by Lazboy Chair (Power Reclining). 4 Seater Sofa. Dressing tables stools. Egan Chair. Gloss bedside lockers
https://mollanbros.co.uk/lift-rise-chairs,"Windsor Single Motor Lift & Rise Chair, Savoy Dual Motor Lift & Tilt Recliner, Parker Lift & Rise Chair (Fabric), Sandringham Dual Motor Lift & Rise Chair, Windsor Dual Motor Lift & Rise Chair (Full Leather), Penrith Electric Lift & Tilt Chair, Riva Rise & Recline Chair, Parker Lift & Tilt Chair (Leather), Lincoln Standard Dual Motor Lift + Rise Chair (Fabric), Windsor Dual Motor Lift + Rise Chair",Leather Accent Chairs. Sintered Stone Tables. Mirrored Bedside Lockers. D89cm x W84cm x H109cm. Mirrored Dressing Tables. Parker Lift & Rise Chair (Fabric). Chest of Drawers. Kids Beds & Bunks. Recently viewed products. 2 Seater Sofa. Marble Effect Tables. Wooden bedside lockers. Mirrored chest of Drawers. 3 Seater Sofa. Gloss dressing tables. Penrith Electric Lift & Tilt Chair. Compare products list. Windsor Single Motor Lift & Rise Chair. Wooden Dressing Tables. Gloss Chest of Drawers. Riva Rise & Recline Chair. Parker Lift & Tilt Chair (Leather). Features & Dimensions. GridListFilters51020per pagePositionName: A to ZName: Z to APrice: Low to HighPrice: High to LowCreated on. Lift & Rise Chairs. Shipping & returns. Nest of Tables. Add to cart. Tempered Glass Tables. Sandringham Dual Motor Lift & Rise Chair. PositionName: A to ZName: Z to APrice: Low to HighPrice: High to LowCreated on. Wooden Chest of Drawers. 4 Seater Sofa. Dressing tables stools. Savoy Dual Motor Lift & Tilt Recliner. Windsor Dual Motor Lift & Rise Chair (Full Leather). Gloss bedside lockers
https://mollanbros.co.uk/console-tables,"Arianna Console Table, Arturo Console Table, Salisbury Console Table, Stow Natural Oak 1 Drawer Console, Stow Painted 1 Drawer Console Table (Grey), Stow Painted 1 Drawer Console Table (White), Stow Painted 2 Drawer Console Table (Blue), Stow Painted 2 Drawer Console Table (Grey), Stow Painted 2 Drawer Console Table (White), Amelia 1 Drawer Console Table (Cream)",Arianna Console Table. Leather Accent Chairs. Sintered Stone Tables. Mirrored Bedside Lockers. Stow Natural Oak 1 Drawer Console. Amelia 1 Drawer Console Table (Cream). Mirrored Dressing Tables. Chest of Drawers. Recently viewed products. Kids Beds & Bunks. Stow Painted 2 Drawer Console Table (Blue). 2 Seater Sofa. Stow Painted 2 Drawer Console Table (Grey). Marble Effect Tables. Wooden bedside lockers. Mirrored chest of Drawers. 3 Seater Sofa. Gloss dressing tables. Arturo Console Table. Compare products list. Wooden Dressing Tables. Gloss Chest of Drawers. Stow Painted 1 Drawer Console Table (Grey). GridListFilters51020per pagePositionName: A to ZName: Z to APrice: Low to HighPrice: High to LowCreated on. Lift & Rise Chairs. Shipping & returns. Console/Telephone Tables. Stow Painted 1 Drawer Console Table (White). Nest of Tables. Salisbury Console Table. Add to cart. Tempered Glass Tables. PositionName: A to ZName: Z to APrice: Low to HighPrice: High to LowCreated on. Wooden Chest of Drawers. 4 Seater Sofa. Dressing tables stools. Stow Painted 2 Drawer Console Table (White). Gloss bedside lockers
https://mollanbros.co.uk/coffee-tables,"Arianna Coffee Table, Arturo Coffee Table, Salisbury Coffee Table, Salisbury Coffee Table with Drawer, Salisbury Large Coffee Table, Salisbury Large Coffee Table + Drawers, Stow Natural Oak 2 Drawer Coffee Table, Stow Natural Oak Standard Coffee Table, Stow Painted Coffee Table with 2 Drawers (Grey), Stow Painted Coffee Table with 2 Drawers (White)",Leather Accent Chairs. Sintered Stone Tables. Mirrored Bedside Lockers. Mirrored Dressing Tables. Chest of Drawers. Recently viewed products. Kids Beds & Bunks. Salisbury Coffee Table with Drawer. 2 Seater Sofa. Marble Effect Tables. Wooden bedside lockers. Mirrored chest of Drawers. 3 Seater Sofa. Stow Painted Coffee Table with 2 Drawers (White). Gloss dressing tables. Wooden Dressing Tables. Compare products list. Coffee Tables. Gloss Chest of Drawers. Arianna Coffee Table. Stow Painted Coffee Table with 2 Drawers (Grey). Salisbury Large Coffee Table. Stow Natural Oak 2 Drawer Coffee Table. GridListFilters51020per pagePositionName: A to ZName: Z to APrice: Low to HighPrice: High to LowCreated on. Lift & Rise Chairs. Shipping & returns. Nest of Tables. Add to cart. Tempered Glass Tables. PositionName: A to ZName: Z to APrice: Low to HighPrice: High to LowCreated on. Arturo Coffee Table. Wooden Chest of Drawers. Stow Natural Oak Standard Coffee Table. 4 Seater Sofa. Salisbury Coffee Table. Dressing tables stools. Gloss bedside lockers
https://mollanbros.co.uk/display-units,"Salisbury Corner Display Cabinet, Salisbury Display Cabinet, Stow Natural Oak Display Cabinet, Stow Natural Oak Low Display Unit, Stow Painted Glass Display Unit (Grey), Stow Painted Glass Display Unit (White), Stow Painted Low Display Unit (Grey), Stow Painted Low Display Unit (White)",Leather Accent Chairs. Sintered Stone Tables. Mirrored Bedside Lockers. Display Units. Mirrored Dressing Tables. Chest of Drawers. Recently viewed products. Kids Beds & Bunks. Stow Painted Low Display Unit (Grey). 2 Seater Sofa. Salisbury Display Cabinet. Marble Effect Tables. Wooden bedside lockers. Mirrored chest of Drawers. 3 Seater Sofa. Gloss dressing tables. Wooden Dressing Tables. Compare products list. Gloss Chest of Drawers. Stow Natural Oak Display Cabinet. GridListFilters51020per pagePositionName: A to ZName: Z to APrice: Low to HighPrice: High to LowCreated on. Lift & Rise Chairs. Shipping & returns. Nest of Tables. Stow Painted Low Display Unit (White). Stow Painted Glass Display Unit (Grey). Salisbury Corner Display Cabinet. Add to cart. Tempered Glass Tables. PositionName: A to ZName: Z to APrice: Low to HighPrice: High to LowCreated on. Wooden Chest of Drawers. 4 Seater Sofa. Dressing tables stools. Stow Natural Oak Low Display Unit. Stow Painted Glass Display Unit (White). Gloss bedside lockers
